title,slug,blurb,body,category
"Pixels, Adam Sandler's newest movie, is complete and utter garbage",http://www.vox.com/2015/7/24/9032149/pixels-review-garbage,"Pixels is a crime against video games, women, and film.","<p><a href=""http://www.imdb.com/title/tt2120120/""><em>Pixels</em></a> is a movie.</p> \n<p>This is the nicest thing I can say about it. It is a motion picture in the same way that any space with four walls and a window is considered a bedroom in Manhattan, and in the same way that lampreys are fish. It's not so much a film as it is an all-out assault on the senses, a middle finger to anyone with a brain. It's an open taunt, daring people (and their children) to spend money on a gaping malpractice of creativity.</p> \n<p><!--  ########  BEGIN SNIPPET  ########  --></p> \n<div class=""chorus-snippet ratingbox"">\n<!-- add number from 1 to 5 where the 3 is --> \n<div class=""rating-container""> \n<p>Rating</p> \n<hr> \n<span class=""rating-number"">0</span>\n</div> \n</div> \n<!--  ########  END SNIPPET  ########  --> \n<p><br id=""1437751641693""></p> \n<p> </p> \n<p>""You know Space Invaders?"" Sam Brenner, a former video game wunderkind played by <a href=""http://www.imdb.com/name/nm0001191/?ref_=tt_cl_t1"" target=""_blank"">Adam Sandler</a>, asks Ludlow Lamonsoff (<a href=""http://www.imdb.com/name/nm1265802/?ref_=tt_cl_t5"" target=""_blank"">Josh Gad</a>). ""Because you're invading my space.""</p> \n<p>That's actually one of the film's better jokes. The rest tend to float around, mealy bits of sexism and archaic stereotypes in <em>Pixel</em><i>s</i>' fetid green pond of humor. <a href=""http://www.imdb.com/title/tt2120120/?ref_=ttmd_md_nm"" target=""_blank""><i>Pixels</i></a><em>,</em> directed by Chris Columbus, written by Tim Herlihy and Timothy Dowling, and produced by the slop shop that is Happy Madison, holds being aggressively lazy as its main ambition. In this world, men are literally rewarded with beautiful women as prizes, dorks are still basement dwellers living with their mothers, kids have hot moms, and Kevin James is president of the United States.</p> \n<p>But the movie's worst sin — aside from believing that Kevin James could win a general election — is that it manages to deface the culture it wants to affectionately revere. This is supposed to be a movie about video games, the endless joy and entertainment they can bring, and how we've lost those feelings over time. But the people writing and creating this movie don't seem to care enough to do any of these ideas justice — or make a movie at all worth it.</p> \n<h3>\n<em>Pixels</em> plays on nostalgia but doesn't understand it</h3> \n<p><img data-chorus-asset-id=""3904294"" alt=""MV5BMTYwMDk4ODA4OF5BMl5BanBnXkFtZTgwMjMxODcyNjE_._V1__SX1359_SY583_.0.jpg"" src=""https://cdn2.vox-cdn.com/uploads/chorus_asset/file/3904294/MV5BMTYwMDk4ODA4OF5BMl5BanBnXkFtZTgwMjMxODcyNjE_._V1__SX1359_SY583_.0.jpg""></p> \n<p class=""caption"">This movie defecates on Pac-Man's legacy. (Sony)</p> \n<p>No video game character has affected my life like Final Fantasy's Black Mage (and his assorted permutations). Tiny in stature, draped in a blue cloak, and sporting a bent witch's hat, this little guy can churn out devastating spells that break the sky with thunder and set the screen ablaze with flames.</p> \n<p>I remember relating to him because I, too, am fragile and not built for hand-to-hand combat. My parents wouldn't allow me to play during the week, but they did allow me to stay up and play for as long as I wanted on Friday and Saturday nights. When I think of those Friday nights, I remember drinking sugary sodas until my teeth tingled, staying up to cast one more spell, falling asleep with the game still buzzing, beating one last boss, and waiting all week to do it all over again.</p> \n<p>So <em>Pixels</em> should have been an easy sell to me.</p> \n<p>Yet after the initial flutters of joy in seeing Pac-Man blown up to the size of a house, I fell increasingly numb as I realized this film had no interest in exploring the magic of video games. <em>Pixels</em> knows Pac-Man will make its audience members feel things (nostalgia, awe, happiness), but it isn't interested in what those emotions are or why they exist.</p> \n<p>Instead, the characters and video games are shoved into an overcooked storyline where aliens picked up a transmission of our video games and took it as a threat. They weaponize our nostalgia, setting video game characters and loose as destructive forces on Earth. This isn't a bad premise — video games have often reacted to and reflected upon some of the darker parts of human existence, and it would be easy to see how an alien race could pick up on that.</p> \n<p>Yet <em>Pixels</em> doesn't.</p> \n<p>The film is intellectually lazy, and yet its plot is still somehow overwrought. No real logic centers the weaponized video game idea — Sandler and the rest of the earthlings play good characters in their first battle (Centipede) and bad (Pac-Man's ghosts) in another; there are cheat codes, but no explanation as to how to enter them. And the film is based on a bizarre plot hole: Why would aliens so powerful not just wipe out the planet instead of challenging its inhabitants to video game contests?</p> \n<p>Because our military isn't trained in video games (despite flying drones), it's up to old-school gamers, now fully grown man-children Brenner (Sandler), Lamonsoff (Gad), President Will Cooper (James), and Eddie Plant (Peter Dinklage) to save the day. (At moments, watching Gad and Dinklage, you almost have to wonder just what sort of leverage Sandler has over them.)</p> \n<p>Even when dealing with its heroes, <em>Pixels</em> is a lifeless letdown. These men are part of the dated joke that video game players live with their moms and are unattractive, sexually deprived creeps. It fails to recognize that we live in an age where geekdom and video games are mainstream, indelible parts of pop culture. Instead, <i>Pixels</i> is content to wallow in the man-baby fantasy of what someone who's never played video games thinks of the losers (""LOSERS! amirite!!!!?"") who do.</p> \n<h3>This might also be one of the most mind-bogglingly sexist movies ever created</h3> \n<p><img data-chorus-asset-id=""3904292"" alt=""MV5BMjA1OTMzMTAxN15BMl5BanBnXkFtZTgwOTIxODcyNjE_._V1__SX1359_SY583_.0.jpg"" src=""https://cdn1.vox-cdn.com/uploads/chorus_asset/file/3904292/MV5BMjA1OTMzMTAxN15BMl5BanBnXkFtZTgwOTIxODcyNjE_._V1__SX1359_SY583_.0.jpg""></p> \n<p class=""caption"">The best actor in this photo is the orange guy. (Sony)</p> \n<p>One of the rules in <em>Pixels</em> is that when the humans win a video game battle (it's best two out of three), they are rewarded with a trophy. One of these trophies is Q-Bert, the trumpet-snouted, orange being who was somehow the hero of an '80s video game. Q-Bert ends up being one of the best actors in the movie, which says a lot since he basically snorts cheese balls and urinates himself.</p> \n<p>But the most startling thing that happens to Q-Bert is that the character eventually turns into a beautiful, silent (she does not speak) female ninja warrior (played by <a href=""http://www.imdb.com/name/nm1667364/?ref_=tt_cl_t13"" target=""_blank"">Ashley Benson</a>), so that Lamonsoff is not left without a girlfriend at the end of the film.</p> \n<p>That turns out to be the basic premise of the film: Women are trophies made to be won.</p> \n<p>Serena Williams (in a cameo), Martha Stewart (also in said cameo), Jane Krakowski,  and <a href=""http://www.imdb.com/name/nm1157358/?ref_=tt_cl_t3"" target=""_blank"">Michelle Monaghan</a> all appear in this film as objects of the men's desires. They are all severely underused, and are, with the exception of Krakowski who plays the first lady, won by the men by the end of the film. Krakowski, a gifted comedic actress (you might know her best as <em>30 Rock</em>'s Jenna), is given a paltry number of lines, two of which are devoted to asking Brenner how attractive Monaghan's character is.</p> \n<p>It all makes you wonder how desperate a time it is for women in Hollywood to sign on to play these parts.</p> \n<p>That's depressing, but disappointment is the underlying theme in <em>Pixels</em>. This movie could have been great. That moment of joy from seeing the video game characters of your childhood making a big-screen debut and glowing like radioactive candy is real — before it reveals itself to be just one moment in an endless trickle of listlessness.</p> \n<!--  ########  BEGIN VOLUME VIDEO  ########  --> \n<div class=""volume-video"" id=""volume-placement-48"" data-volume-placement=""article"" data-analytics-placement=""entry:middle"" data-volume-id=""2365"" data-volume-uuid=""79dc33cfa"" data-analytics-label=""Why fewer computer graphics make for better movies | 2365"" data-analytics-action=""volume:view:entry:middle"" data-analytics-viewport=""video""></div> \n<!--  ########  END VOLUME VIDEO  ########  -->",Movies
Channing Tatum is dropping out of Foxâ€™s Gambit movie,http://www.vox.com/2015/7/29/9064761/channing-tatum-gambit,This is not good.,"<ol> \n<li> <span>According to </span><a target=""_blank"" href=""http://www.thewrap.com/channing-tatum-superhero-movie-gambit-in-jeopardy-as-deal-unravels-exclusive/"">the Wrap</a><span>, Channing Tatum is leaving Fox's </span><i>Gambit</i><span> movie.</span> </li> \n<li>It's unclear whether Tatum will remain as a producer.</li> \n<li>Gambit is an X-Man with the power to kinetically ""charge"" objects, usually cards.</li> \n<li>The movie is scheduled for an October 2016 release.</li> \n</ol> \n<h3>A big surprise and a potential bummer for Fox</h3> \n<p><a href=""http://entertainthis.usatoday.com/2015/07/11/comic-con-live-fox-brings-deadpool-fantastic-four-more/"" target=""_blank"">Two weeks ago</a>, Tatum surprised fans at San Diego Comic-Con, getting everyone hyped up about Fox's <i>Gambit</i> movie and a future in which Gambit, the X-Men, and Fantastic Four — Fox's superhero properties — could cross over.</p> \n<p>Today, that future seems to be crumbling.</p> \n<p>Tatum is said to be exiting the project and leaving Fox without a leading man. <a target=""_blank"" href=""http://www.thewrap.com/channing-tatum-superhero-movie-gambit-in-jeopardy-as-deal-unravels-exclusive/"">The Wrap reported</a>:</p> \n<blockquote> \n<p>It is unclear whether Tatum and his producing partner Reid Carolin plan to remain involved in a producing capacity, or whether Simon Kinberg and Lauren Shuler Donner will move forward on their own.</p> \n</blockquote> \n<p>This would, no doubt, be a disappointment for Fox. Tatum has momentum right now, and fans were genuinely excited for Fox's projects at Comic-Con. Tatum was even<a href=""http://entertainthis.usatoday.com/2015/07/11/comic-con-live-fox-brings-deadpool-fantastic-four-more/"" target=""_blank""> joking around on stage and posing for photos</a>.</p> \n<p>The departure may have something to do with Tatum wanting something bigger for himself and the character. There are hints that he would eventually want to direct. According to the Wrap:</p> \n<blockquote> \n<p>""Gambit"" has long been a passion project for Tatum, whose attachment encouraged 20th Century Fox to ramp up production. However, Tatum also has larger ambitions, which may play a role in the current situation.</p> \n</blockquote> \n<hr> \n<!--  ########  BEGIN VOLUME VIDEO  ########  --> \n<div class=""volume-video"" id=""volume-placement-4695"" data-volume-placement=""article"" data-analytics-placement=""entry:middle"" data-volume-id=""2365"" data-volume-uuid=""79dc33cfa"" data-analytics-label=""Why fewer computer graphics make for better movies | 2365"" data-analytics-action=""volume:view:entry:middle"" data-analytics-viewport=""video""></div> \n<!--  ########  END VOLUME VIDEO  ########  -->",Movies
Jon Stewartâ€™s Daily Show interviews werenâ€™t great. Ask Jennifer Lawrence.,http://www.vox.com/2015/8/6/9101051/daily-show-stewart-interview,Jennifer Lawrence called him out on it.,"<p>Jon Stewart's <i>Daily Show </i>has been filled with memorable moments. The moments of Zen, the segments, the monologues, the breaks in character — it's hard to separate all of these moments from how Stewart handled them.</p> \n<p>The show's interviews, for better or worse, are the same way.</p> \n<p>Stewart has a style that makes interviews feel more like friends hanging out, instead of a platform for actors and guests to talk about their latest projects, movies, and books. That can be great (the better friends Stewart is with someone, the more entertaining the interviews are), but sometimes these segments can feel skippable.</p> \n<p>In an 2013 interview to promote <i>The Hunger Games: Catching Fire</i>, which would go on to be the highest-grossing movie that year, <a href=""http://thedailyshow.cc.com/videos/6c62ce/jennifer-lawrence"" target=""_blank"">Jennifer Lawrence called him on it </a>— Stewart tried to skirt around talking about the film, instead talking about her haircut and how she looks like Helen Mirren.</p> \n<p>""I don't prepare for these things very well,"" Stewart admitted to her.</p> \n<p>""That's actually what your producers and everyone involved in the show tell everyone,"" Lawrence said (in a kind way). ""They're like, 'He's not really gonna know a lot about the movie or a lot about you.'""</p> \n<p>And in typical Stewart (and Lawrence) style, the exchange is totally endearing.</p> \n<!--  ########  BEGIN VOLUME VIDEO  ########  --> \n<div class=""volume-video"" id=""volume-placement-4467"" data-volume-placement=""article"" data-analytics-placement=""entry:middle"" data-volume-id=""2276"" data-volume-uuid=""0a970c281"" data-analytics-label=""Why the Daily Show had to change | 2276"" data-analytics-action=""volume:view:entry:middle"" data-analytics-viewport=""video""></div> \n<!--  ########  END VOLUME VIDEO  ########  -->",Movies
Fantastic Four is an unmitigated garbage fire,http://www.vox.com/2015/8/7/9114501/fantastic-four-movie-review,This is the worst superhero movie of the past 20 years.,"<p>Watching <a href=""http://www.imdb.com/title/tt1502712/fullcredits?ref_=tt_ov_wr#writers"">Fox's </a><a href=""http://www.imdb.com/title/tt1502712/fullcredits?ref_=tt_ov_wr#writers""><em>Fantastic Four</em></a><a href=""http://www.imdb.com/title/tt1502712/fullcredits?ref_=tt_ov_wr#writers""> feels</a> like taking a cheese grater to your soul. Why would you want to take something beautiful and precious and grind it up into flaccid, soggy pulp? It's impossible to explain.<!--  ########  BEGIN SNIPPET  ########  --></p> \n<div class=""chorus-snippet ratingbox"">\n<!-- add number from 1 to 5 where the 3 is --> \n<div class=""rating-container""> \n<p>Rating</p> \n<hr> \n<span class=""rating-number"">.5</span>\n</div> \n</div> \n<p><span>Maybe we should ask the people who made this dumpster fire dressed as a movie.</span></p> \n<p>That distinction would go to director-writer <a href=""http://www.imdb.com/title/tt1502712/fullcredits?ref_=tt_ov_wr#writers"">Josh Trank and screenwriters Simon Kinberg and Jeremy Slater</a>, and it's hard to understand why these people didn't adopt pseudonyms. I can't fathom anyone wanting to hitch their name to this. If the <em>Fantastic Four</em> franchise were a <a href=""http://www.vox.com/2015/7/28/9064325/cecil-the-lion"" target=""_blank"">lion</a>, Trank, Kinberg, and Slater would be rotting in a jail cell in Zimbabwe.</p> \n<h3>\n<em>Fantastic Four</em> is the worst superhero movie in 20 years</h3> \n<p>""I'm an adult. I'm old enough to make my decisions,"" Johnny Storm (Michael B. Jordan) tells his father Franklin (Reg. E. Cathey).</p> \n<p>That's how the movie's characters speak when they're not dropping nods to the comics, like saying ""Dr. Doom over here"" to Dr. Doom (Toby Kebbell) or ""You're in your element"" to the Human Torch (Jordan). It's indicative of how Trank, Kinberg, and Slater approached this haphazard film. The story bends and shifts without any point. Plots are dropped, ignored, and spun at a whim. The characters' actions come out of nowhere, as if the only logic in this world is ""Because I said so.""</p> \n<p>The resulting movie feels like animus toward the source material. It outstinks the terrible <a href=""http://www.rottentomatoes.com/m/wolverine/"" target=""_blank""><i>X-Men Origins — Wolverine</i></a>, and is the worst superhero movie since <a href=""http://www.rottentomatoes.com/m/1077027-batman_and_robin/"" target=""_blank""><i>Batman &amp; Robin</i></a>.</p> \n<h3>There's no reason for this movie to be this terrible</h3> \n<p>On paper, there's no reason that this film can't be good. Miles Teller, an edgeless, fleshy-lidded Shia LaBeouf, is the perfect combination of dick and dork to play the genius Reed Richards. Kate Mara was created in a laboratory to play Sue Storm. Michael B. Jordan and Jamie Bell are also talented, charismatic actors — the kind you need to play the Human Torch and the Thing, particularly the latter, who must emote through a heavy layer of CGI special effects. And Trank gave us <a href=""http://www.imdb.com/title/tt1706593/"" target=""_blank""><i>Chronicle</i></a>, an inventive, found-footage take on the horror of giving superpowers to petulant teens.</p> \n<p>Plus, the Fantastic Four is the superhero team that defined superhero teams. Created by Stan Lee and Jack Kirby, the four heroes — Reed has the power to stretch himself to impossible limits; Sue can create force fields and become invisible; Johnny can turn into a human fireball; Ben became a stone golem with incredible strength — are some of the most complex and riveting characters Marvel has ever created.</p> \n<p>They have opposing views of goodness and don't get along. They feel like they're monsters, but they're actually celebrities. They want to do good. They're selfless. They're family. Basically anything that we praise modern superhero tales for, the Fantastic Four were doing earlier and better.</p> \n<p>Thanks to thousands of pages of source material and 50 years of development, you could flip open any Fantastic Four comic book to a random page and find something interesting to put on screen. Instead, what Trank and friends have decided to do is spend 100 minutes stitching together five or six terrible mini-films, all falling over one another to be the last one standing.</p> \n<p>The most successful and endearing parts of the film are the first 20 minutes, which introduce Reed Richards and his pal Ben Grimm as children in Oyster Bay, New York. Reed is a nerd, Grimm is rough stuff, and together they build a machine that can transport people to a different dimension ... or planet ... or planet in another dimension (the film can't decide). There's a sense of wonderment (a nifty callback to the '60s-era space race that fueled the original comic book) that nearly evokes something magical like <em>E.T.</em> or <em>Super 8.</em></p> \n<p>Then, just when it gets good, it feels like whoever wrote those first 20 minutes went on an impromptu strike. The friendship plot line is dropped out of nowhere and not picked up again until the last act. We're instead thrust into a story about two dudes nerd-fighting over a girl. This is followed, for some reason, with commentary on baby boomers ruining Mother Earth, the government being terrible, and NASA being terrible, before we return to interdimensional space travel again. It's a massive jumble of aborted plot strands and ideas that go nowhere.</p> \n<p>Once the Four get their powers, however, things settle down a bit. For five minutes we get to take a breath and see something cool and inventive. What's interesting about the Four is that the powers they get make their lives a living hell — and some lives are more hellish than others. The Human Torch's fire consumes him, Invisible Woman drifts in and out of vision, Mr. Fantastic is stretched thin, and Grimm is a rocky, ugly monster.</p> \n<p>But then, as quickly as the characters get their powers, we're randomly pushed forward a year to when three of the four are training as government supersoldiers.</p> \n<p>If the movie had stayed on one path, it might have been decent. Cramming every single one of these haphazard plots into the same story, however, tanks it.</p> \n<h3>The last 20 minutes of <em>Fantastic Four</em> are so bad, it's funny</h3> \n<p>With all these mini-films fighting for dominance in this giant turd of a movie, everyone kind of forgets that the Fantastic Four need someone to fight. Thus, the last 20 minutes are devoted to checking off this one, final box.</p> \n<p>""We have to stop Victor. He is the source,"" are actual words said by alleged genius Reed Richards. He arrives at this revelation after Victor has already annihilated a government base and bested the Four in one fight. The declaration is said with the amount of enthusiasm you might have when accepting a lukewarm beer.</p> \n<p>The last fight scene is an orgy of bubbles, bad CGI, still shots of Dr. Doom, and misplaced lines. But what makes it so glorious is that the movie was so sparse on action sequences until this point. Could a massively exciting action sequence have pulled it out of its torpor? Maybe. There was a flicker of hope in my heart that Trank might pull it off, at least. But as with the rest of this Eeyore of a film, Trank manages to mosey sideways into the big action.</p> \n<p>People say only true fans will appreciate a bad movie — that they, the true believers, will find a way to mitigate hot awfulness and disappointment with empathy. Trank and his team have created the opposite of this: something that's openly hostile to anyone with a tiny bit of interest in the Fantastic Four.</p>",Movies
