title,slug,blurb,body,category
How space trash could start a nuclear war,http://www.vox.com/2014/4/21/5625246/space-war-china-north-korea-iran,"Like Star Wars, but for real.","<p>Panic in the skies! ""The threats to U.S. space assets are significant and growing,"" according to a new report from the Council on Foreign Relations, which warns that there's a real chance of breaching conflict's final frontier.</p> \n<p>This isn't idle fearmongering. The report makes a not-crazy case that efforts by China and other powers to limit America's total military dominance of space could accidentally destroy an American satellite, inadvertently convincing the US that war was coming and prompting retaliation on Earth. <span>Its author, Micah Zenko, has </span><a style=""background-color: #ffffff; line-height: 1.5;"" href=""http://www.theamericanconservative.com/articles/the-anti-warrior/"">made a name</a><span> for himself in report-after-report downplaying the threat to the United States from China, terrorists, and, really, </span><a style=""background-color: #ffffff; line-height: 1.5;"" href=""http://blogs.cfr.org/zenko/2012/02/23/clear-and-present-safety-the-united-states-is-more-secure-than-washington-thinks/"">most things</a><span>. So that fact that Zenko is this </span><a style=""background-color: #ffffff; line-height: 1.5;"" href=""http://www.cfr.org/space/dangerous-space-incidents/p32790?sp_mid=45655631&amp;sp_rid=emFjay5iZWF1Y2hhbXBAZ21haWwuY29tS0"">concerned about space</a><span> should tell you something.</span></p> \n<p><q class=""center"" aria-hidden=""true"">If the US thinks China is trying to take out its ability to detect nukes, things could get very bad, very quickly.</q></p> \n<p>The basic dynamic is simple: the US controls space and its opponents don't. Of all the money spent on space by all countries combined, America <a href=""http://www.cfr.org/space/dangerous-space-incidents/p32790?sp_mid=45655631&amp;sp_rid=emFjay5iZWF1Y2hhbXBAZ21haWwuY29tS0"">spends</a> 75 percent. It also owns 43 percent of all satellites. It uses that huge satellite network for, among other things, all sorts of military spying and coordination purposes. At one point, the Bush Administration <a href=""http://www.armscontrol.org/act/2004_11/Krepon"">mused openly</a> about putting actual weapons pointed at Earth in space.</p> \n<p>Countries who might hypothetically fight a war with the United States hate that space dominance, which gives the US a real strategic edge. Some have <a href=""http://www.stimson.org/images/uploads/Anti-satellite_Weapons.pdf"">developed</a> anti-satellite (ASAT) weapons, usually missiles that shoot into space. Zenko thinks ASAT weapons are really dangerous, particularly those owned by China, North Korea, and Iran. The threat comes from both deliberate use and the risk of a misunderstanding that could spiral out of control.</p> \n<p>The ""greatest threat to international space security,"" in Zenko's view, is a Chinese accident. China is <a href=""http://america.aljazeera.com/articles/2014/4/16/china-s-presidentxiurgesgreatermilitaryuseofspace.html"">seriously investing</a> in ASAT weaponry, which it has tested by blowing up old satellites in low earth orbit, one of the places place where satellites live. <span>These explosions create debris, which can travel tens of thousands of miles per hour and shred up other satellites and spacecraft. </span></p> \n<p><span>If debris from a Chinese test destroys a US military satellite</span><span>, the US could mistake it as a preemptive strike against its space capabilities &mdash; some of which are </span><a href=""http://www.pbs.org/wgbh/nova/military/nuclear-false-alarms.html"">designed</a><span> to detect nuclear missile launches. </span><span>If the US thinks China </span><span>is trying to take out its ability to detect a nuclear launch, things could get very bad, very quickly.</span></p> \n<p><img src=""http://cdn3.vox-cdn.com/assets/4316261/missile_nasa.png"" class=""photo"" alt=""Missile_nasa""></p> \n<p class=""caption"">NASA</p> \n<p>Accidents aren't the only concern. Zenko also worries about intentional space attacks, either during peacetime or a crisis. Here, Iran and North Korea are probably bigger threats, though their ASAT capabilities are far from proven.</p> \n<p>North Korea has a pattern of crazy military moves designed to extort concessions from South Korea and the West; it could extend that behavior to space. Iran, according to Zenko, ""already views space as a legitimate arena in which to contest US military power."" He worries that Iran might fire missiles into space ""during a major crisis, especially if it believes war is imminent &mdash; an assessment that could have self-fulfilling consequences.""</p> \n<p>But even if none of these scenarios for war are likely, preparing and testing for space war is intrinsically dangerous. Space debris don't discriminate between military and non-military satellites; the more ASAT testing there is, the more hazardous space travel becomes for everyone. As satellites become increasingly important to the economy and scientific research, even preparation for space war becomes deadly.</p> \n<p><img src=""http://cdn0.vox-cdn.com/assets/4316333/Screen_Shot_2014-04-17_at_4.30.40_PM.png"" class=""photo"" alt=""Screen_shot_2014-04-17_at_4""></p> \n<p class=""caption"">Pictured: not actual space combat. Howard Longden/Flickr CC</p> \n<p><span>So what is to be done? Zenko has a 12-point list of recommendations, including investing in debris cleanup capabilities and a US declaration unilaterally forswearing ASAT weapons. These aren't pipe dreams: the US and Soviet Union negotiated the Outer Space Treaty, which </span><a href=""http://www.state.gov/t/isn/5181.htm"" style=""background-color: #ffffff; line-height: 1.5;"">banned</a><span> ""orbital weapons of mass destruction,"" in 1967.</span></p> \n<p>If the US and Soviet Union could do that at the height of the Cold War, the prospects for space arms control are real. Until then, though, it's worth lifting up our eyes and looking towards the heavens.</p>",Space
Bad news for anyone going to Mars: space radiation could make you dumber,http://www.vox.com/2014/4/25/5652566/space-radiation-causes-cognitive-impairments,Researchers showed that rats exposed to space-style radiation have cognitive deficits,"<p>One of the biggest dangers for long-term space travel — say, <a href=""http://www.vox.com/cards/mars-exploration/what-are-the-dangers-of-living-on-mars"">astronauts going to Mars</a> — is the radiation in outer space. <span>We already know that it </span><a href=""http://www.jpl.nasa.gov/news/news.php?release=2013-356"">can raise the risk</a><span> of cancer. But now there's evidence it can make us dumb, too.</span></p> \n<p><q aria-hidden=""true"" class=""right"">One of the biggest dangers of long-term space travel is radiation</q></p> \n<p>A new paper in <i>Radiation Research</i> finds that rats developed slower reaction times and more lapses in attention after being exposed to the radiation that people would get on a two-year trip to Mars. (The Earth's magnetic field normally protects us from most of this radiation.)</p> \n<p>The figure below shows the rats' scores on a cognitive test over time. The top line is rats that weren't exposed to radiation. The bottom line is rats that were exposed and whose cognitive abilities declined:</p> \n<p><img src=""http://cdn3.vox-cdn.com/assets/4356381/Figure1.png"" class=""photo"" alt=""Figure1""></p> \n<p class=""caption"">Davis et al. Radiat Res. 2014 181(3):258-71.</p> \n<p>The bad news is that radiation could cause astronauts to have slower reaction times and more lapses in attention — important components of a fitness test they have to take before spacewalks.</p> \n<p><span>The encouraging news is that the radiation caused these effects in just 45 percent of the rats tested, suggesting that astronauts could be screened for their risks before space travel — and that it might be possible to develop therapies to help them.</span></p>",Space
Russia is kicking NASA out of the International Space Station in 2020,http://www.vox.com/2014/5/13/5714650/russia-just-evicted-nasa-from-the-international-space-station,"Starting in 2020, US astronauts will no longer be able to hitch a ride to space.","<p>On Tuesday, <a style=""line-height: 1.5;"" href=""http://www.theverge.com/2014/5/13/5714462/russia-will-cut-off-us-access-to-the-international-space-station-over"" target=""_blank"">Russia announced</a> that starting in 2020, it will no longer allow NASA astronauts on the International Space Station, in retaliation for sanctions levied by the US because of  <a style=""line-height: 1.5;"" href=""http://www.vox.com/cards/ukraine-everything-you-need-to-know/what-is-the-ukraine-crisis"" target=""_blank"">Russia's invasion of Crimea</a>.</p> \n<p>How can Russia bar American astronauts from a station that both countries own? Simple. Right now, NASA relies on Russian rockets to get its astronauts to and from space, <span>paying them</span><span> </span><a style=""background-color: #ffffff; line-height: 1.5;"" target=""_blank"" href=""http://www.thewire.com/national/2014/03/nasa-is-paying-russia-71-million-for-a-ride-to-space/359559/"">$70.7 million</a><span> </span><span>for each one-way ticket.</span></p> \n<p><q class=""right"" aria-hidden=""true"">NasA relies on russian rockets to get its astronauts to and from space</q></p> \n<p>The surprising announcement won't affect the<span> US astronaut and two Russian cosmonauts currently</span><a style=""background-color: #ffffff; line-height: 1.5;"" href=""http://www.howmanypeopleareinspacerightnow.com/"" target=""_blank""> aboard the International Space Station</a><span>, orbiting about 260 miles above Earth's surface, or the future missions there planned over the next few years. </span></p> \n<p><span>But the most recent plans were for the station </span><span>to operate </span><a style=""background-color: #ffffff; line-height: 1.5;"" href=""http://www.washingtonpost.com/national/health-science/nasa-space-station-operation-extended-by-obama-until-2024-at-least/2014/01/08/9819d5c8-788e-11e3-8963-b4b654bcc9b2_story.html"" target=""_blank"">at least until 2024</a>. <span>Now, with Russia angered by the sanctions — </span><span>especially those blocking high-tech exports that might help the Russian military — </span><span>that no longer seems to be possible.</span></p> \n<p>If these tensions don't resolve by 2020, things could really get messy in space. Private American space companies are hoping to have their own transport systems in place by then — so NASA could theoretically access the station on its own — but Russia is claiming that its space agency, Roscosmos, would try to operate its portion of the station without NASA involvement.</p> \n<p><span>""The Russian segment can exist independently from the American one. The US one cannot,""</span><span> </span><span>Russian deputy prime minister Dmitry Rogozin </span><a target=""_blank"" href=""http://in.reuters.com/article/2014/05/13/ukraine-crisis-russia-usa-idINL6N0NZ4EA20140513"">said during the announcement</a>.</p> \n<p>That's probably not true: the majority of the station's power, among other capabilities, comes from solar panels on the American segment. Without both countries' involvement, it seems unlikely that the station — the only occupied outpost our species has in space — can survive. And either<span> way, it's clear that the two countries' space relationship, once a triumph of the post-Cold War era, is quickly going down the pipes.</span></p> \n<h3>How the US and Russia became strange space bedfellows</h3> \n<p><img src=""http://cdn0.vox-cdn.com/assets/4397433/476712829.jpg"" class=""photo"" alt=""476712829""></p> \n<p class=""caption"">NASA astronaut Steven Swanson (left) trains with cosmonauts Alexander Skvortsov (center) and Oleg Artemyev (right) before their March 2014 launch to the space station. AFP/Getty Images</p> \n<p>Back in 2004, President Bush announced that <span>NASA's aging space shuttle program would be retired in 2010 and — eventually — replaced by a plan to return to the moon</span><span>. At the time, NASA realized </span><span>there would be a four-year gap between the space-shuttle retirement and when </span><span>the new manned space transport system would be in place.</span></p> \n<p><span>But at that point, it didn't seem like a big problem for NASA to ask Russia to transport US astronauts to and from the space station in the interim</span><span>. Relations between the two countries were friendly — Bush was telling reporters that he'd looked into Putin's eyes and ""</span><a style=""background-color: #ffffff; line-height: 1.5;"" target=""_blank"" href=""http://news.bbc.co.uk/2/hi/1392791.stm"">got a sense of his soul</a>.<span>"" What's more, </span><span>NASA had relied on Russian transport for</span><span> 29 months after the <i>Columbia</i> disaster in 2003, when the shuttle program was put on hold.</span></p> \n<p><q class=""right"" aria-hidden=""true"">At the time, it didn't seem like a big problem to ask Russia to transport NASA astronauts</q></p> \n<p><span></span><span>Development of NASA's replacement vessels, however, has taken much longer than anticipated — the agency won't have a replacement for the shuttle until 2017. There are a few reasons for that. Bush's </span><span>moon program was</span><a href=""http://news.bbc.co.uk/2/hi/science/nature/8489097.stm"" target=""_blank"" style=""background-color: #ffffff; line-height: 1.5;""> cancelled by Obama</a><span> in 2010 and replaced with a plan for private companies to shuttle astronauts. Meanwhile, NASA's budget requests to pay for the new program </span><a target=""_blank"" href=""http://cle/panel-report-warns-underfunding-may-affect-commercial-crew-program"">were repeatedly underfunded</a><span> by Congress. </span></p> \n<p><span>""</span><span>It's put us in a vulnerable position,"" </span><span>says </span><span>John Logsdon</span><span>, former director of the Space Policy Institute</span><span>.</span></p> \n<p>This isn't even the <i>only</i> way that the US spaceflight program is dependent on Russia. The <a target=""_blank"" href=""http://en.wikipedia.org/wiki/Atlas_V"">Atlas V rocket</a> — built by a joint Lockheed Martin-Boeing venture and used to launch American military satellites and civilian payloads — runs on a Russian-built engine.</p> \n<p>When the Atlas V was being designed in the 1990s, Lockheed Martin got a waiver from the usual Defense Department requirement that critical components be manufactured in the US, partly because the Russian engines were better and less expensive than American options, and partly because of political motivations.</p> \n<p>""There was a fear that if we didn't find some way of keeping Russian rocket scientists employed, they would go off and work for Iran or North Korea,"" says <span>James Lewis</span><span>, a national security and space analyst</span><span>.</span></p> \n<p>But this hasn't exactly worked out as planned either. I<span>n yesterday's announcement, Rogozin also said that all deliveries of the engines for use in launching American military satellites would be stopped. Lockheed Martin and Boeing currently have a two-year supply of them stockpiled, but if the situation doesn't change by 2016, this could be a problem.</span></p> \n<h3>The Space Station brings the US and Russia together</h3> \n<p><img alt=""International_space_station_after_undocking_of_sts-132"" class=""photo"" src=""http://cdn2.vox-cdn.com/assets/4397473/International_Space_Station_after_undocking_of_STS-132.jpg""></p> \n<p class=""caption"">The International Space Station. <a style=""line-height: 1.5;"" href=""http://spaceflight.nasa.gov/gallery/images/shuttle/sts-132/hires/s132e012208.jpg"" target=""_blank"">NASA</a></p> \n<p>When construction of <span>the International Space Station was begun in 1998, it was </span><span>seen as an embodiment of the new age of cooperative space exploration — a permanent scientific alliance </span><span>between a number of countries, but especially longtime rivals US and Russia. The two countries launched separate segments of the station that were assembled in orbit.</span></p> \n<p>Obviously, the tenor of Russian-American relations has changed, but in space, the two countries are still codependent. <span>NASA astronauts travel to and from the station — used mostly </span><span>for </span><a href=""http://www.nasa.gov/mission_pages/station/research/international_partners.html#.U2LCGK1dU01"" target=""_blank"" style=""line-height: 1.5;"">scientific experiments</a><span> on long-term human spaceflight — </span><span>on Russian Soyuz rockets, launched from the Baikonur Cosmodrome, in Kazakhstan, the cradle of Soviet space exploration since the 1957 launch of Sputnik. </span></p> \n<p><q class=""right"" aria-hidden=""true"">The whole thing is designed to operate with both American and Russian involvement</q></p> \n<p><span>The next launch is scheduled for May 28, when a rocket </span><a href=""http://www.nasa.gov/mission_pages/station/expeditions/expedition40/index.html#.U2LFZa1dU00"" target=""_blank"" style=""background-color: #ffffff; line-height: 1.5;"">carrying American, Russian, and German astronauts</a><span> will take off to replace the current crew. The astronauts will live together in extremely close quarters for about six months, and if anything goes wrong, they'll depend on a </span><a target=""_blank"" href=""http://www.nasa.gov/mission_pages/station/structure/elements/soyuz/#.U2PMw61dWXg"" style=""line-height: 1.5;"">Russian spacecraft</a> docked at the station to serve as an emergency lifeboat.</p> \n<p>But the Russian astronauts are also heavily dependent on NASA. The US segment makes up the <span>majority of the space station, by area. Its solar panels provide most of the electricity, and its gyroscopes are crucial in controlling the station in orbit. </span></p> \n<p><span></span><span>As a whole, the space station </span><span>takes instructions from command centers in Houston and Korolyvov. The whole thing is designed to operate with both American and Russian involvement, and it's hard to imagine it surviving otherwise.</span></p> \n<h3><span>But NASA and Roscosmos seem headed for a breakup</span></h3> \n<p><img src=""http://cdn2.vox-cdn.com/assets/4397481/480522779.jpg"" class=""photo"" alt=""480522779""></p> \n<p class=""caption"">NASA astronaut Steven Swanson, in pre-launch preparations at the Baikonur Cosmodrome in March. Maxim Shipenkov/AFP/Getty Images</p> \n<p>Even before the announcement, a few events suggested that<span> political strife between US and Russia could </span><span>spill over into the space relationship.</span></p> \n<p><span>Last month, as part of the sanctions process, </span><span>NASA announced that it would be </span><a style=""background-color: #ffffff; line-height: 1.5;"" href=""http://www.theverge.com/2014/4/2/5574896/nasa-suspends-contracts-with-russia"" target=""_blank"">suspending all non-essential contact</a><span> with Russia. </span><span>That order had lots of exceptions — including anything space station-related — but it clearly wasn't conducive to a good working relationship in space.</span></p> \n<p><q class=""right"" aria-hidden=""true"">These events have made the need to develop american space transport more urgent</q></p> \n<p>In response to the sanctions,<span> </span><span>Rogozin initially </span><a href=""https://twitter.com/Rogozin/status/461137034292527104"" target=""_blank"" style=""line-height: 1.5;"">tweeted</a><span> </span><span>""I suggest to the USA to bring their astronauts to the International Space Station using a trampoline."" With the announcement,</span> he's apparently making good on that promise.</p> \n<p>The recent events — and the Ukraine crisis as a whole —<span> have made the need to develop American manned space transport more urgent. The current plan is for NASA</span><span> to </span><a href=""http://www.nasa.gov/exploration/commercial/crew/"" target=""_blank"" style=""background-color: #ffffff; line-height: 1.5; background-image: none !important;"">award a grant to one of three private companies</a><span> (Boeing, Sierra Nevada, or SpaceX), so they can upgrade their cargo-carrying rockets for human use.</span></p> \n<p><span>The day after Rogozin's initial tweet</span><span>, a House subcommittee</span><span> </span><a href=""http://www.usatoday.com/story/news/nation/2014/04/30/nasa-commercial-crew-program-house-appropriations/8527815/"" target=""_blank"" style=""background-color: #ffffff; line-height: 1.5;"">fully approved a $785 million NASA funding request</a><span> </span><span>for the private space flight plan — an increase from recent years — and </span><a target=""_blank"" href=""http://www.csmonitor.com/Science/2014/0430/Trampolines-to-space-Where-Ukraine-crisis-leaves-a-Russia-dependent-US"">added money to the Defense Department's 2015 budget</a><span> specifically to develop an American replacement for the Russian-made rocket engines.</span></p> \n<p><img alt=""480542679"" class=""photo"" src=""http://cdn2.vox-cdn.com/assets/4397489/480542679.jpg""></p> \n<p class=""caption"">A Russian Soyuz rocket bearing NASA astronauts and Russian cosmonauts takes off for the space station on March 26, 2014. Vasily Maximov/AFP/Getty Image</p> \n<p>To make a difference right now, though, these appropriations would've needed to come years ago. Even with more money, the private companies likely won't be ready to carry humans to space until 2017, and the Lockheed Martin-Boeing venture would need a few years to develop a homegrown rocket engine alternative as well.</p> \n<p><span>What's more, the International Space Station currently represents the entirety of manned space activities by NASA. The US can figure its own ways of putting astronauts in space, but it doesn't really have any destinations that don't involve Russia. </span><span>When Obama cancelled the Moon program, </span><a target=""_blank"" href=""http://en.wikipedia.org/wiki/Space_policy_of_the_Barack_Obama_administration"" style=""background-color: #ffffff; line-height: 1.5;"">he outlined vague plans</a><span> to send a manned mission to an asteroid by 2025 and </span><a target=""_blank"" href=""http://www.vox.com/cards/mars-exploration/what-are-our-long-term-plans-for-exploring-mars"" style=""line-height: 1.5;"">Mars sometime thereafter</a><span>,  but </span><a target=""_blank"" href=""http://www.washingtonpost.com/opinions/dana-milbank-nasas-goal-of-a-manned-mars-mission-doesnt-match-budget-reality/2014/04/22/4c004df4-ca62-11e3-95f7-7ecdde72d2ea_story.html"" style=""background-color: #ffffff; line-height: 1.5;"">many argue</a><span> that these goals are unrealistic given current NASA funding levels.</span></p> \n<p>For now, it seems, if NASA wants to have humans in space, it's dependent on American-Russian tensions being resolved in the next few years. ""All this ought to <span>serve as a wakeup call for Congress,"" Logsdon says. ""If they don't provide more funding, we're going to continue along in this vulnerable situation.""</span></p> \n<hr> \n<p><b>Correction</b>: this story previously stated Lockheed Martin made the Altas V rocket, instead of a joint venture between Lockheed Martin and Boeing.</p>",Space
