title,slug,blurb,body,category
This six-second clip shows how awful The Interview truly is,http://www.vox.com/2014/12/24/7447961/interview-clip,"For some reason, in the film Kim Jong Un insists that he ""has a butthole.""","<p>Everyone has heard that <i>The Interview</i>, the Sony Pictures comedy at the center of this month's North Korea cyberattack news, is <a href=""http://www.rottentomatoes.com/m/the_interview_2014/"" target=""_blank"">supposed to be terrible</a>. But goofy comedies are often panned by critics, and in any case there's perhaps some appeal to seeing a movie that has so been in the news.</p> \n<p><q class=""right"" aria-hidden=""true"">""I have a butthole""</q></p> \n<p>Unfortunately for Sony, now that it has allowed the film to be streamed online, people are actually watching it, and what they are seeing is worse even than the already rock-bottom expectations. It's hard to imagine that anything could possibly sum that up better than this six-second clip from the film, uploaded by BuzzFeed foreign editor Miriam Elder:</p> \n<p><iframe frameborder=""0"" height=""600"" width=""600"" src=""https://vine.co/v/OH7j67Fz9nn/embed/simple"" class=""vine-embed""></iframe> \n<script charset=""utf-8"" src=""//platform.vine.co/static/scripts/embed.js""></script> \n</p> \n<p>Here's what's happening in the clip, as best I can tell: North Korean leader Kim Jong Un, portrayed by Korean-American actor Randall Park, is explaining to the famous American TV host who has come to interview him, portrayed by James Franco, that he does indeed ""pee and poo."" He adds, ""I have a butthole.""</p> \n<p>While Kim is thought to speak English, it's difficult to imagine him ever discussing his ""pee and poo.""</p> \n<p>More to the point, it's difficult to imagine how or why anyone at Sony Pictures could think that this scene would be remotely funny, or even amusing. There's not even really a joke here. Yet, somehow, dozens of people participated in this very expensive project, in which millions of dollars were spent and an international incident sparked — if unintentionally — so that movie-goers could hear an American-accented Kim Jong Un explain that he does in fact ""poo.""</p> \n<p>Amazingly, <i>The Interview</i> is a full one hour and 52 minutes, meaning that it is as long as watching this clip 1,120 consecutive times. It's one way to spend the holidays, I suppose.</p>",Movies
The Interview's filmmakers should donate their proceeds to a charity for North Koreans,http://www.vox.com/2014/12/29/7454395/interview-north-korea-charity-donate,Seth Rogen and James Franco can prove their critics wrong â€” and maybe save some lives in the process.,"<p>The question of what <i>The Interview</i> and the larger drama around it mean for North Korea is, to say the least, disputed.</p> \n<p>Many say it <a href=""http://www.washingtonpost.com/blogs/wonkblog/wp/2014/12/24/the-interview-really-does-subvert-north-koreas-regime/"" target=""_blank"">hurts</a> North Korean leader Kim Jong Un by belittling him, others that it <a href=""http://www.vox.com/2014/12/24/7443035/interview-north-korea"" target=""_blank"">helps</a> him by making him look more powerful and relevant than he really is, and others still that it helps him by <a href=""http://www.theatlantic.com/international/archive/2014/12/north-korea-is-not-funny-the-interview-sony/383885/"" target=""_blank"">trivializing</a> his monstrousness. Some say it is sowing <a href=""http://www.businessinsider.com/north-korean-demand-for-the-interview-2014-12"" target=""_blank"">desire for freedom</a> among North Koreans; others that its portrayal of Koreans is <a href=""https://medium.com/@maxine_builder/the-real-problem-with-the-interview-is-its-racism-not-its-satire-4d0cd30d5f0d"" target=""_blank"">racist and condescending</a>.</p> \n<p><span>The film's supporters have argued that </span><i>The Interview</i><span> is a brave stand for freedom and a blow to Kim's despotic regime. Maybe so, maybe not. But it is making plenty of money. If Seth Rogen, James Franco, and others associated with the movie really want to make this about helping North Koreans, then the best possible thing they could do is endorse an excellent idea proposed by BuzzFeed foreign editor </span><a style=""font-size: 1.15em; line-height: 1.65; background-color: #ffffff;"" href=""https://twitter.com/HayesBrown/status/548603865172824064"" target=""_blank"">Hayes Brown</a><span>: donate the proceeds to a group doing human rights work with North Koreans.</span></p> \n<h3>Why donating to a human rights group is the best possible thing <i>The Interview</i> could do for North Korea</h3> \n<p><img data-chorus-asset-id=""2883926"" alt=""Diana Bang portrays a North Korean officer in The Interview, with Seth Rogen and James Franco (Sony Pictures)"" src=""https://cdn3.vox-cdn.com/uploads/chorus_asset/file/2883926/8053642-fe.0.jpg""></p> \n<p class=""caption"">Diana Bang portrays a North Korean officer in <i>The Interview</i>, with Seth Rogen and James Franco (Sony Pictures)</p> \n<p>The truth is that no one can say for sure what effect the film will have on North Korea and its 25 million citizens, who live under what is by far the most unfree, cruelest, and most abusive government on earth. The film's supporters do have a reasonable case that the movie could have an effect inside North Korea, but that effect is likely to be small.</p> \n<p>The best case is that the flurry of international media coverage (including from North Korea's own state media) will somehow reach North Koreans, normally closed off from the outside world, who will scrape together the money to smuggle in pirated copies from China. Once some North Koreans see the film, the thinking goes, they will find the cartoonish and mocking portrayal of Kim Jong Un so liberating that they will question the entire system built around his rule.</p> \n<p><span>Even if that does happen, its impact on the North Korean system is likely to be marginal. T</span><span>he Kim regime survived a 1990s famine that wiped out as many as one in 10 citizens. It has survived the influx of information about the outside world, beginning in the 2000s, that finally showed that the propaganda about North Korea's great wealth was a lie and that South Koreans live in unimaginable prosperity. It is likely to weather a comedy in which Kim Jong Un </span><a target=""_blank"" href=""http://www.vox.com/2014/12/24/7447961/interview-clip"" style=""font-size: 1.15em; line-height: 1.65; background-color: #ffffff;"">announces</a><span>, ""Yes, I have a butthole, and it's working overtime.""</span></p> \n<p>That is not to dismiss the potential for <i>The Interview</i> to have some positive effect on North Korea, merely to put the potential scope of that effect in context.</p> \n<p>There is another way that <i>The Interview</i> can reach North Koreans: by donating to an aid group, charity, or NGO that works with North Koreans.</p> \n<p>The film's impact, even in the best-case, will be indirect and abstract and difficult to measure — and at the cost of a $44 million production budget. Donating to a human rights group, however, would be direct, tangible, and very easy to measure. Seth Rogen and James Franco could count and possibly even meet the North Koreans whose lives they would have bettered or even saved. And it would come at a much lower cost than the $44 million film.</p> \n<h3>North Koreans badly need our help — and so do the groups trying to help them</h3> \n<p><img data-chorus-asset-id=""2883908"" alt=""52987123.0.jpg"" src=""https://cdn0.vox-cdn.com/uploads/chorus_asset/file/2883908/52987123.0.jpg""></p> \n<p class=""caption"">North Korean boys eat a meal provided by the World Food Program, which has since run out of money (Gerald Bourke/WFP via Getty)</p> \n<p>It is difficult to articulate the full extent of the horrors facing North Koreans, from the ever-present threat of political violence to the smothering ubiquity of propaganda to the <a target=""_blank"" href=""http://www.vox.com/2014/10/27/7073029/north-korea-gulags-prison-camps-explainer"">gulag system</a> in which one percent of the population is routinely tortured, starved, and murdered.</p> \n<p>Donating to an aid group is not going to end those abuses. But there is another category of problems that aid groups can address.</p> \n<p>One problem is getting information in and out of North Korea. The abstract ideas conveyed in an <i>Interview</i>-style satire are fine, but there is a much more fundamental need for transferring nuts-and-bolts basic information in and out of the country — and in Korea. Some North Korean rights groups focus on broadcasting information in to the country about the truth of what's happening within the country and in the world. People inside the country can, in turn, transmit out critical intelligence about happenings there. Smuggling networks and defector groups can better coordinate. That all costs money, but it's money that is put into direct, demonstrably positive use for helping North Koreans.</p> \n<p><q aria-hidden=""true"" class=""right"">Rescuing one defector costs about $3,000</q></p> \n<p>Another major problem is getting defectors out of the country. It's not just crossing the border. Defectors need guides who can ferry them secretly across China, dodging the Chinese authorities who will send them home to be punished, then into southeast Asia, then to South Korea. The trip is long, dangerous, and expensive.</p> \n<p>Some defectors sell themselves into slavery to afford the trip; others are sold by duplicitous ""guides."" Many die along the way, or spend their lives trapped in forced labor or sexual slavery. Aid groups exist that quietly fund defector guides and ""underground railroads;"" with the kind of money that Franco and Rogen are making on <i>The Interview</i>, they could help many more defectors, saving them from the horrors of North Korea and from the perils of an unguided journey.</p> \n<p>Once defectors make it to South Korea, though, they find themselves totally unequipped to survive in the South's fast-paced and extremely competitive economy — not to mention in a society where North Koreans are often looked down upon. It's not just that they don't know how to use a computer or go shopping. The brutally ubiquitous state control of life in North Korea leaves them with few social skills. Many defectors fall into poverty and depression. Some aid groups do great work helping defectors adjust and come to support themselves. But these groups could do a lot more with more funding.</p> \n<p>The groups working within North Korea itself are, naturally, severely limited by the North Korean government. But some United Nations programs are still able to bring in food and medicine, which are both often in dire short supply in the country, especially for children. Those programs are perpetually underfunded.</p> \n<p>Raising American awareness about North Korea's evil dictator through a comedic film is all well and good, but <i>The Interview</i>'s filmmakers and supporters have an opportunity to channel that awareness into real, direct action that could bring concrete change for North Koreans. There is no better way to do that than by redirecting the film's proceeds into one or several of the great charities and aid groups who are helping North Koreans right now, but who need our help to do so.</p> \n<p>Rogen and Franco, by making this show of support for North Koreans, could show that they really mean what they say about this film being about making a difference, could help channel all the energy around the film into a larger movement for donating to North Korean aid groups, and could change the conversation about their film.</p> \n<h3>Some charities Rogen and Franco might want to consider giving to</h3> \n<p><iframe scrolling=""no"" frameborder=""0"" height=""360"" width=""640"" src=""https://embed-ssl.ted.com/talks/joseph_kim_the_family_i_lost_in_north_korea_and_the_family_i_gained.html""></iframe></p> \n<p class=""caption"">Joseph Kim, a North Korean refugee who was helped by Liberty in North Korea, discusses his experience in a Ted Talk.</p> \n<p><b>1) </b><a target=""_blank"" href=""http://www.wfp.org/get-involved/donate"">United Nations World Food Program</a><b>: </b>North Korea's famine ended in the 1990s, but hunger and malnutrition are still rampant, as are occasional ""micro-famines"" due to localized food shortages. The United Nations <a target=""_blank"" href=""http://www.wfp.org/countries/korea-democratic-peoples-republic-dprk"">fought hard</a> to get access to North Korea so its World Food Program can help feed women and children (the country does not allow it to feed adult men). But the program is <a target=""_blank"" href=""http://www.wsj.com/articles/u-n-north-korea-food-program-in-danger-1411626874"">perilously underfunded</a> — so much so that it is planning on shutting down entirely this year. Unless, that is, some miracle donors step up.</p> \n<p><b>2) </b><a target=""_blank"" href=""http://www.unicef.org/dprk/"">United Nation's Children's Fund</a><b> (UNICEF): </b>This UN agency focuses specifically on children and, like the World Food Program, has rare access to directly helping North Koreans. It focuses on food and medicine, as well as access to sanitary water and education (although the last program is, as you can imagine, limited by the government). It is not as dangerously underfunded as the World Food Program, but it can always use more.</p> \n<p><b>3) <a target=""_blank"" href=""http://www.libertyinnorthkorea.org/"">Liberty in North Korea</a>: </b>The California-based group rescues North Korean defectors, guiding them from the moment they cross the border into China — which, remember, works very hard to find defectors and send them home — all the way to South Korea or the US, where they provide training and resettlement assistance. The group estimates it costs about $3,000 to rescue one defector. With the $1 million that <i>The Interview</i> made just on its first day at the box office, it could bring 333 North Koreans from suffering in North Korea to freedom in South Korea or the US. That's enough to fill two or three movie theaters.</p> \n<p><b>4) </b><a href=""http://www.hrnk.org/"" target=""_blank"">Committee for Human Rights in North Korea</a><b>: </b>The US-based group focuses on helping North Koreans through a number of projects: raising awareness and pressure on North Korea's massive forced labor gulag system, helping North Korean women who are sold into sexual slavery in China, and working with companies that work in North Korea to do so ethically.</p> \n<p><b>5) North Korean media groups: </b>Often composed in part or in whole of North Korean defectors, <a target=""_blank"" href=""http://www.theatlantic.com/magazine/archive/2011/04/north-koreas-digital-underground/308414/"">these groups</a> focus on getting information in and out of North Korea. This means mass media, such as radio transmissions, and telling North Korea the truth about what's happening in their country and in the world. It also makes it much easier to enable smuggling goods into the country and people out. Here are a few: <a target=""_blank"" href=""http://www.dailynk.com/english/index.php"">Daily NK</a>, <a target=""_blank"" href=""http://english.nkradio.org/"">Open Radio for North Korea</a>, <a target=""_blank"" href=""http://newfocusintl.com/"">New Focus International</a>.</p>",Movies
Vin Diesel wants you to think he's in Marvel's next bigÂ franchise,http://www.vox.com/2014/12/29/7461123/diesel-inhumans-movie-marvel,"On Monday morning, there was a buzz about a movie we won't even see until 2018.","<p><span>On Monday morning, there was a buzz about a Marvel movie we won't even see until 2018. Vin Diesel (or someone on his team) swapped the cover image on his Facebook page to one that refers to Marvel's </span><a style=""font-size: 1.15em; line-height: 1.65; background-color: #ffffff;"" href=""http://www.vox.com/2014/8/13/5997383/inhumans-explainer-marvel-movie"" target=""_blank"">Inhumans</a><span> movie:</span></p> \n<p><img data-chorus-asset-id=""2886514"" alt=""Screen_Shot_2014-12-29_at_8.13.28_AM.0.png"" src=""https://cdn0.vox-cdn.com/uploads/chorus_asset/file/2886514/Screen_Shot_2014-12-29_at_8.13.28_AM.0.png""></p> \n<p class=""caption"">(Facebook)</p> \n<p><a style=""font-size: 15px; line-height: 1.65;"" href=""http://www.vox.com/2014/8/13/5997383/inhumans-explainer-marvel-movie"" target=""_blank"">The Inhumans</a>, a race of people with wondrous superpowers, have become major players in Marvel's comic books, and ""Are You Inhuman?"" is the tagline for <a href=""http://www.vox.com/2014/10/29/7087649/captain-marvel-black-panther-explained"" target=""_blank"">their upcoming movie</a>. Diesel's image strongly hints he's somehow involved in the new project.</p> \n<p>Here's why people think this image suggests that:</p> \n<h3>1) He's done this before</h3> \n<p>This isn't the first time that Diesel has hinted at involvement with the Inhumans. Back in August, Diesel made a post on Facebook that also hinted at his involvement with the Inhumans:</p> \n<div id=""fb-root""></div> \n<p> \n<script type=""text/javascript""><!-- \n(function(d, s, id) { var js, fjs = d.getElementsByTagName(s)[0]; if (d.getElementById(id)) return; js = d.createElement(s); js.id = id; js.src = ""//connect.facebook.net/en_US/all.js#xfbml=1""; fjs.parentNode.insertBefore(js, fjs); }(document, 'script', 'facebook-jssdk')); \n// --></script> \n</p> \n<div class=""fb-post"" data-href=""https://www.facebook.com/VinDiesel/photos/a.101465923312.101581.89562268312/10152718210358313/?type=1"" data-width=""466""> \n<div class=""fb-xfbml-parse-ignore"">\n<a href=""https://www.facebook.com/VinDiesel/photos/a.101465923312.101581.89562268312/10152718210358313/?type=1"">Post</a> by <a href=""https://www.facebook.com/VinDiesel"">Vin Diesel</a>.</div> \n</div> \n<p>That was before Marvel had announced it was making a movie and around the time people were wondering what Marvel was going to do next. <i>Guardians of the Galaxy</i> had opened to big box office numbers and was universally well-received, and it increasingly seemed Marvel could do no wrong.</p> \n<p>In hindsight, now that we know that Marvel is planning an Inhumans movie, Diesel's tease makes it seem as if he's been in on Marvel's future plans for a while.</p> \n<h3>2) Vin Diesel would be the perfect Black Bolt</h3> \n<p><img data-chorus-asset-id=""2887050"" alt=""Screen_Shot_2014-12-29_at_11.01.46_AM.0.png"" src=""https://cdn3.vox-cdn.com/uploads/chorus_asset/file/2887050/Screen_Shot_2014-12-29_at_11.01.46_AM.0.png""></p> \n<p class=""caption"">(Marvel)</p> \n<p>Black Bolt is the leader and face of the Inhumans. He's superhumanly buff to the point where his muscles have muscles. With that in mind, casting Black Bolt would require someone who has action movie pedigree <i>and</i> someone who could physically (or at least look like they could) go toe to toe with WWE wrestlers.</p> \n<p>The number of actors who could play a convincing Black Bolt would already be slim, but with actors like Tom Hardy, The Rock, and Jason Momoa,<b> </b>signed on to DC projects and Bautista reprising his role as Drax the Destroyer in <i>Guardians 2</i>, those numbers are even slimmer.</p> \n<p>And Diesel, it just so happens, would be perfect for the role. He's physically imposing enough to command Black Bolt's gravitas. And Black Bolt's brooding nature wouldn't expose his weaknesses as an actor — other members of the Inhumans like Black Bolt's wife <a href=""http://www.vox.com/2014/8/13/5997383/inhumans-explainer-marvel-movie"" target=""_blank"">Medusa</a>, or the charismatic villain <a href=""http://www.vox.com/2014/8/13/5997383/inhumans-explainer-marvel-movie"" target=""_blank"">Maximus</a> do the heavy lifting when it comes to emotions, depth, and humor.</p> \n<h3>3) And it could all work out</h3> \n<p><img data-chorus-asset-id=""2887022"" alt=""Screen_Shot_2014-12-29_at_10.57.45_AM.0.png"" src=""https://cdn1.vox-cdn.com/uploads/chorus_asset/file/2887022/Screen_Shot_2014-12-29_at_10.57.45_AM.0.png""></p> \n<p class=""caption"">(Marvel)</p> \n<p>There's one loophole that could conceivably allow Diesel to play Groot and Black Bolt in the same movie: Black Bolt doesn't talk. One of Black Bolt's powers is that he can release huge amounts of energy when he speaks — he can level planets with a scream but can also do some damage with a whisper. It's a blessing and a curse, as Black Bolt has the power to defeat bad guys but has to be constantly vigilant about speaking.</p> \n<p>What this means is that Diesel could play Black Bolt and Groot, and only have to use his voice for one of the roles. There wouldn't be any confusion that two of the characters sound the same, and Marvel would have a nifty little gimmick in having Diesel's image for one character and his voice for another.</p> \n<p>To be clear, all this talk lives in the possibility of what Marvel ""could"" do and that's far removed from what it would ""want"" to do. It would probably prefer to have another A-lister take on Black Bolt, to compete with the buzz vibrating from Warner Bros.'s <a href=""http://www.vox.com/2014/12/3/7325777/suicide-squad-dc-explained"" target=""_blank""><i>Suicide Squad</i></a>, and it would probably want to be more flexible with the Inhumans, as it's a franchise that could — if it includes <a href=""http://www.vox.com/2014/10/14/6972775/marvel-young-adult-novel"" target=""_blank"">Ms. Marvel,</a> one of Marvel's biggest hits in years — appeal to younger audiences than the Avengers<i> </i>— who could seem a bit long in the tooth by 2018 — do. Those are only two of Marvel's plethora of options.</p> \n<p>But even if Marvel doesn't choose to cast Diesel or include him in an Inhumans plot, it certainly doesn't hurt that he's a good company man.</p>",Movies
