title,slug,blurb,body,category
These new photos show Philae's big bounce on the comet,http://www.vox.com/2014/11/17/7235087/philae-photos-comet,We still don't know where exactly Philae is â€” but we're getting a little closer.,"<p>Five days ago,<span> Philae's </span><a href=""http://www.vox.com/2014/11/12/7203081/philae-comet-rosetta"" target=""_blank"">historic landing</a><span> on the comet 67P/G-C did </span><a href=""http://www.vox.com/2014/11/15/7225427/philae-comet-rosetta"" target=""_blank"">not go exactly as planned</a><span>.</span></p> \n<p><span>Data transmitted by the lander told scientists that its harpoons failed to engage, leading it to bounce off the comet's surface twice before coming to a rest about a kilometer from the landing site.</span></p> \n<p>They're still not sure exactly where Philae is, but today,<span> European Space Agency scientists did </span><a href=""http://www.esa.int/spaceinimages/Images/2014/11/OSIRIS_spots_Philae_drifting_across_the_comet"" target=""_blank"">release a series of high-resolution images</a><span> of the landing and subsequent bounce.</span></p> \n<p><img src=""http://cdn3.vox-cdn.com/uploads/chorus_asset/file/2465242/_79086634_79081268.0.jpg"" alt=""philae location"" data-chorus-asset-id=""2465242""></p> \n<p class=""caption"">(ESA/Rosetta/MPS for Osiris Team)</p> \n<p>This composite image, captured by the Rosetta orbiter, shows the tiny lander's locations above the comet for about 30 minutes prior to its landing, as well as its location a moment afterward. You can see the slight disturbances created by Philae at the touchdown point (at top), as well as the outline of the lander off to the right just after it.</p> \n<p><span>Due to the extremely low level of gravity on the comet, </span><span>Philae's first bounce carried it as high as a kilometer above the surface. But the comet did have just enough gravity to pull it back, leading it to land again two hours later, then take another </span><span>bounce before finally settling in a shadowy crater.</span></p> \n<p>As a result, <span>its solar panels were only able to collect about 90 minutes of sunlight every 12 hours, which meant the craft had to rely largely on its battery. Though ESA scientists used mechanical instruments on the craft to turn it slightly in hopes of getting more sunlight, the effort failed, and Philae powered down Friday evening (EST) after 57 hours on the comet.</span></p> \n<h3>Whats next for Philae</h3> \n<p><img src=""http://cdn3.vox-cdn.com/uploads/chorus_asset/file/2455304/comet_surface_vox.0.gif"" alt=""philae eye view"" data-chorus-asset-id=""2455304""></p> \n<p class=""caption"">A composite of six photos taken by Philae in the crater. (ESA)</p> \n<p>Even though Philae's landing didn't go perfectly, the mission as a whole <a target=""_blank"" href=""http://www.vox.com/2014/11/15/7225427/philae-comet-rosetta"">was a huge success</a>. During its brief time on the comet, the lander <span>successfully used all ten of its scientific instruments and gathered all sorts of </span>unprecedented<span> data about its environment. It's estimated that the craft carried out </span><a target=""_blank"" href=""http://www.bbc.com/news/science-environment-30083969"" style=""line-height: 1.5;"">roughly 80 percent</a> of its planned science mission.</p> \n<p>Although Philae was <a target=""_blank"" href=""https://twitter.com/erichand/status/534413817040867328"">reportedly unsuccessful</a> at drilling into the comet and extracting a rock sample, it was able to take <span>photos, </span><span>measure the temperature and density of the comet's surface, and send radar waves through the comet to analyze its interior. Crucially, in its final hours, it sent this valuable data up to Rosetta, which meant it could be relayed back to Earth.</span></p> \n<p><span>Going forward, ESA scientists are going to scrutinize images taken by Rosetta in hopes of pinpointing Philae's location. They say it's quite possible</span><span> that as the comet gradually nears the sun in the spring, the probe could be exposed to additional sunlight and wake back up. Knowing where the craft is and how it's positioned will give them a better idea of just how likely this might be.</span></p> \n<hr> \n<p><b>Update: </b>This post was edited to reflect the news that Philae was unable to extract a rock sample.</p>",Space
Map: The 556 meteors and asteroids that have hit Earth's atmosphere since 1994,http://www.vox.com/2014/11/20/7243813/meteor-asteroid-earth,"If this doesn't convince you we should be worrying more about asteroids, nothing will.","<p>This <a href=""http://neo.jpl.nasa.gov/news/news186.html"" target=""_blank"" style=""background-color: #ffffff;"">new NASA map</a> shows<span> all 556 times an asteroids or meteors entered Earth's atmosphere since 1994 — and gives you an idea of just how regular these events are:</span></p> \n<p><img src=""http://cdn0.vox-cdn.com/uploads/chorus_asset/file/2470052/bolide_events.0.jpg"" alt=""asteroid map"" data-chorus-asset-id=""2470052""></p> \n<p class=""caption"">(<a href=""http://neo.jpl.nasa.gov/news/news186.html"">NASA/JPL</a>)</p> \n<p>The good news is that virtually all of these objects burned up in the Earth's atmosphere, and most posed no danger to us.</p> \n<p>That even includes the largest of these impacts:<span> </span><span>the </span><a href=""http://en.wikipedia.org/wiki/Chelyabinsk_meteor"" target=""_blank"" style=""line-height: 1.5; background-color: #ffffff;"">meteor that exploded</a><span> over Chelyabinsk, Russia in February 2013 (shown as a relatively large yellow circle on the map). Though the explosion released about as much energy as the detonation of 500 tons of TNT, shattered windows, and </span>caused<span> about a thousand injuries, the meteor itself broke up in the air and landed in small pieces on the ground.</span></p> \n<p><span>But the bad news is that a slightly larger object could cause a much more destructive explosion, whether it burned up in the air or hit the ground. And though we've done a good job locating all the truly massive asteroids that would lead to global annihilation, we haven't done nearly as good a job of tracking mid-sized objects that could still cause a lot of damage. In 2005, NASA was tasked with spotting 90 percent of all near-Earth asteroids that could cause significant damage by 2020, but so far, they've </span><a href=""http://www.vox.com/2014/9/16/6226379/nasa-asteroid-risk-location"">only located an estimated 10 percent</a><span>.</span></p> \n<h3>Asteroids are an overlooked risk</h3> \n<p><chorus-asset class=""chorus-snippet browser_wide_media"" data-id=""636474""> <img alt=""Chelyabinsk"" class=""small"" src=""http://cdn0.vox-cdn.com/assets/4335365/161729171.jpg""> </chorus-asset></p> \n<p class=""caption"">The trail of the meteorite that burned up over Chelyabinsk, Russia, in February 2013. (Oleg Kargopolov/AFP/Getty Images)</p> \n<p><span>When most people consider asteroid impacts, they think of the enormous, 10-kilometer wide one that hit Earth some 65 million years ago and likely led to the extinction of the dinosaurs. However, we know about pretty much all of the objects of this size, and none of them </span><span>are on track to hit us.</span></p> \n<p>But it doesn't take a kilometer-sized one to cause a lot of damage. In 1908, an <a href=""http://en.wikipedia.org/wiki/Tunguska_event"" target=""_blank"">asteroid</a> that was somewhere between 60 and 190 meters in diameter exploded over a remote corner of Siberia. <span>This modest asteroid discharged an </span><a style=""line-height: 1.5; background-color: #ffffff;"" href=""https://share.sandia.gov/news/resources/releases/2007/asteroid.html"" target=""_blank"">amount of energy</a><span> 1,000 times greater than the atomic bomb dropped on Hiroshima, scientists estimate, and flattened </span><span>some 80 million trees over a roughly 830 square mile area.</span></p> \n<p>In any given year, the odds of an impact of this size are quite small: it probably only happens every few centuries or so. <span>But the problem is that, given enough time, it will occur. </span></p> \n<p><img data-chorus-asset-id=""2472756"" alt=""asteroid chart"" src=""http://cdn1.vox-cdn.com/uploads/chorus_asset/file/2472756/Screen_Shot_2014-09-16_at_1.21.00_PM.0.0.png""></p> \n<p class=""caption"">(<a href=""http://oig.nasa.gov/audits/reports/FY14/IG-14-030.pdf"">NASA Office of Inspector General</a>)</p> \n<p><span>Earlier this year, </span><a style=""line-height: 1.5; background-color: #ffffff;"" href=""http://www.vox.com/2014/9/2/6083279/long-now-10000-year-clock"" target=""_blank"">I interviewed Alexander Rose</a><span>, the direction of the Long Now Foundation, an organization that thinks our species has failed to engage in truly long-term thinking. He felt an epitome of this was the way we largely disregard the threat of asteroids.</span></p> \n<p><span>""We know that, at some point, a catastrophic meteor or asteroid will impact this planet,"" he said. ""For the first time in human history, we have the capability to detect and potentially divert it. Yet we aren't really putting any money into that.""</span></p> \n<h3>How we could defend ourselves from asteroids</h3> \n<p><span>The first step to protect ourselves from asteroids is seeing them. Currently, we have a few different telescopes here on Earth devoted to spotting near-Earth objects (the </span><a style=""line-height: 1.5;"" href=""http://www.lpl.arizona.edu/css/"" target=""_blank"">Catalina Sky Survey</a> and<span> </span><a style=""font-family: 'Alright Sans', sans-serif; font-size: 15px; line-height: 1.5; background-color: #ffffff;"" href=""http://pan-starrs.ifa.hawaii.edu/public/"" target=""_blank"">Pan-STARRS</a><span> in Hawaii), and they've spotted </span><a style=""line-height: 1.5;"" href=""http://blogs.nature.com/news/2011/09/nasa_meets_asteroid_discovery.html"" target=""_blank"">more than 90 percent</a> of the ones big enough to cause a global catastrophe.</p> \n<p><span>However, to see smaller ones, you need</span><span> telescopes in space, because they don't have to deal with interference from the atmosphere and the sun's glare.</span></p> \n<p><span>NASA has proposed launching</span><span> one of these, called </span><a style=""line-height: 1.5; background-color: #ffffff;"" href=""http://neocam.ipac.caltech.edu/"" target=""_blank"">NEOCam</a><span>, and a private organization called the </span><a style=""line-height: 1.5; background-color: #ffffff;"" href=""http://sentinelmission.org/"" target=""_blank"">B612 Foundation</a><span> is currently raising $450 million for a complementary mission, called Sentinel, that would survey a different area of the sky.</span></p> \n<p><chorus-asset class=""chorus-snippet browser_wide_media"" data-id=""636464""> <img alt=""sentinel"" class=""small"" src=""http://cdn2.vox-cdn.com/assets/4335309/Screen_Shot_2014-04-21_at_2.30.11_PM.png""> </chorus-asset></p> \n<p class=""caption"">A rendering of the proposed Sentinel telescope. (B612 Foundation)</p> \n<p>If both these missions happen, they'd dramatically increase our ability to spot mid-sized asteroids that pose a threat and give us enough time to actually do something. But the NASA mission is still just a proposal — one that is <a href=""http://www.npr.org/2013/11/03/242353389/space-agencies-of-the-world-unite-the-u-n-s-asteroid-defense-plan"" target=""_blank"">reportedly short on money</a> — and the B612 mission is also short of its fundraising goal.</p> \n<p>Further, if we did spot an asteroid heading our way, we don't have any proven means of stopping it. The simplest way would probably be sending a craft crashing into the asteroid, nudging it off its path enough so that it'd miss Earth. The UN has proposed designing and testing a network of small probes that would be capable of doing so, but it's still waiting on the necessary funding from various national space agencies, with an estimated price tag of about <a href=""http://www.npr.org/2013/11/03/242353389/space-agencies-of-the-world-unite-the-u-n-s-asteroid-defense-plan"" target=""_blank"">$2.5 billion</a>.</p> \n<p>That might sound like a lot. But the cost of doing nothing could be infinitely larger. Not long ago, the B612 Foundation produced this map: what it would look like if the 1908 Tunguska asteroid landed squarely in Washington, DC.</p> \n<p><chorus-asset class=""chorus-snippet browser_wide_media"" data-id=""790972""> <img alt=""dc asteroid map"" class=""small"" src=""http://cdn2.vox-cdn.com/uploads/chorus_asset/file/790972/Screen_Shot_2014-04-21_at_1.38.23_PM.0.png""> </chorus-asset></p> \n<p class=""caption"">The impact area of the 1908 asteroid, superimposed on the DC area. (<a href=""http://sentinelmission.org/wp-content/uploads/2013/06/tunguska-blast-infographic-final.png"" target=""_blank"">B612 Foundation</a>)</p> \n<p>Odds are, an asteroid of this size will never land in Washington, DC. But when thinking about this issue, the important thing to remember is that, given enough time, it will <span>happen again somewhere on the planet.</span></p> \n<p><span>When it comes to asteroids, we're talking about natural disasters that are probably preventable. Figuring out how to do so would be a relatively cheap insurance plan that would benefit the entire species.</span></p> \n<p><b>Further reading</b>:</p> \n<ul> \n<li><a target=""_blank"" href=""http://www.vox.com/xpress/2014/9/8/6118717/interactives-calculator-asteroid-meteoroid-meteorite-comet-destroy"">These calculators let you see what would happen if an asteroid hit Earth</a></li> \n<li> <a target=""_blank"" href=""http://www.vox.com/xpress/2014/9/7/6117305/meteorites-asteroids-meteors-meteoroids-bolides-strikes-Earth"">Earth's history of meteorite strikes, in one awesome visualization</a>:</li> \n</ul> \n<p><img data-chorus-asset-id=""2473004"" alt=""bolides"" src=""http://cdn3.vox-cdn.com/uploads/chorus_asset/file/2473004/Screen_Shot_2014-09-07_at_10.50.44_AM.0.0.png""></p> \n<p class=""caption"">(<a href=""http://bolid.es/"">bolid.es</a>)</p>",Space
A Japanese probe is heading to an asteroid â€” to bring rock samples back to Earth,http://www.vox.com/2014/12/1/7314429/hayabusa-asteroid,The rocks could tell us a lot about the origin of the Solar System and perhaps even life on Earth.,"<p>Last month, the European Space Agency's <a href=""http://www.vox.com/2014/11/12/7203081/philae-comet-rosetta"">Philae lander made history</a> by becoming the first spacecraft to land on a comet.</p> \n<p>On Tuesday, the Japanese space agency <a href=""http://global.jaxa.jp/"">JAXA</a> began an even more ambitious mission: it launched <a href=""http://www.jspec.jaxa.jp/e/activity/hayabusa2.html"">Hayabusa 2</a>, a probe that will travel to an asteroid, collect a rock sample, and bring it back to Earth.</p> \n<p><q aria-hidden=""true"" class=""right"">scientists hope the probe will help us learn about the origin of the solar system</q></p> \n<p>This isn't actually the first such mission JAXA has conducted. In 2010, the original Hayabusa probe successfully returned to Earth after landing on the asteroid <a href=""http://en.wikipedia.org/wiki/25143_Itokawa"">25143 Itokawa</a> and picking up microscopic grains of dust from its surface.</p> \n<p>However, that earlier probe was originally intended to collect a much larger rock sample and other scientific data, but due to a few different malfunctions, that wasn't possible. JAXA scientists are hopeful that the new Hayabusa 2 will collect more data on an asteroid that's actually more scientifically interesting, because it's more likely to contain significant amounts of water and organic molecules.</p> \n<h3>The Hayabusa-2 mission</h3> \n<p><img data-chorus-asset-id=""2507504"" alt=""hayabusa 3"" src=""https://cdn1.vox-cdn.com/uploads/chorus_asset/file/2507504/0feff5d7cb9bf07f32fdd17a514c3ca4__1_.0.jpg""></p> \n<p class=""caption"">Technicians attach Hayabusa-2 to an H-2A launcher. (JAXA)</p> \n<p>The probe was successfully launched Tuesday evening at 11:22 pm EST, after a<a href=""http://spaceflightnow.com/2014/11/30/launch-of-japanese-asteroid-probe-delayed/"" style=""font-size: 1.15em; line-height: 1.65; background-color: #ffffff;""> few delays</a> due to weather problems.</p> \n<p>In terms of hardware, it's a slight upgrade on its predecessor, and will also use a set of four ion engines to travel towards the tiny asteroid <a href=""http://en.wikipedia.org/wiki/%28162173%29_1999_JU3"">1999 JU3</a>. The asteroid, which is roughly a kilometer wide, orbits the Sun just a bit farther out than Earth, but closer in than Mars.</p> \n<p><img data-chorus-asset-id=""2507500"" alt=""hayabusa orbit"" src=""https://cdn2.vox-cdn.com/uploads/chorus_asset/file/2507500/Screen_Shot_2014-12-01_at_12.49.18_PM.0.png""></p> \n<p class=""caption"">The orbits of both asteroids, along with Earth and Mars. (<a href=""http://science.nasa.gov/media/medialibrary/2012/05/04/Hayabusa-2_--_Hajime_Yano.pdf"">NASA</a>)</p> \n<p>Hayabusa-2 is projected to arrive at the asteroid in the summer of 2018, remain there for a year and a half, then arrive back on Earth towards the end of 2020. Unlike the previous probe, it'll deploy a small explosive device while landing on the asteroid, and by filming the explosion and collecting some of the debris that result from it, scientists hope to learn more about the asteroid's interior.</p> \n<p>Additionally, the original Hayabusa was equipped with a secondary mini-lander, which would have hopped across the asteroid's surface and taken  more photos of it. However, due to communication problems, it failed to deploy upon landing. Hayabusa-2 will carry an identical lander, along with more sophisticated cameras and a spectrometer that will hopefully collect additional data on the asteroid.</p> \n<h3>Why scientists want to learn about asteroids</h3> \n<p><img data-chorus-asset-id=""2507510"" alt=""hayabusa 4"" src=""https://cdn3.vox-cdn.com/uploads/chorus_asset/file/2507510/haya2_swingby.0.jpg""></p> \n<p class=""caption"">(JAXA)</p> \n<p>One of the main reasons for sending a probe to an asteroid is similar to the motivation for the Philae mission: by learning about the composition of these celestial bodies, we can learn more about the formation of the solar system 4.5 billion years ago, and perhaps even about how life originally formed on Earth.</p> \n<p>That's because most asteroids and comets formed shortly after the birth of the Solar System, when other debris gradually coalesced to form the planets. And some scientists hypothesize that these objects actually <a href=""http://www.smithsonianmag.com/science-nature/how-did-water-come-to-earth-72037248/?no-ist"">brought water to Earth</a> as part of collisions sometime after this period, making life possible (there are also other hypotheses, such as the idea that water gradually leaked out of hydrous minerals in rocks). By sending probes to asteroids and comets to sample them, we can get clues about whether this idea is correct.</p> \n<p><q aria-hidden=""true"" class=""right"">some scientists hypothesize that asteroids and comets originally brought water to earth</q></p> \n<p>The new Hayabusa probe will be visiting a <a href=""http://en.wikipedia.org/wiki/C-type_asteroid"">C-type asteroid</a>, a type of asteroid that's more likely to contain substantial amounts of water ice and organic materials than the <a href=""http://en.wikipedia.org/wiki/S-type_asteroid"">S-type asteroid</a> visited by Hayabusa 1. If it can successfully collect and return larger samples of rock and ice, scientists will be able to chemically analyze them — for instance, looking at the <a href=""http://en.wikipedia.org/wiki/Chirality_%28chemistry%29"">chirality</a> of the organics, or the ratio of different isotopes in the ice, and seeing if they match those on Earth.</p> \n<p>Doing this sort of analysis on meteorites that have crashed into Earth is less valuable, since it's impossible to tell whether they've been contaminated by substances in our own atmosphere on the way down. Additionally, this analysis wasn't possible with the first Hayabusa probe, because its malfunctions meant it only ended up bringing back microscopic grains of dust that got sucked into its collection mechanism, and they didn't include any ice.</p> \n<p>But carrying out this analysis on a larger sample from the new Hayabusa 2 probe, which scientists believe is more likely to include water ice, carbon-based molecules, and perhaps even amino acids, could tell us a lot — namely, whether this sort of asteroid, millions of miles away, may have been crucial in seeding life on Earth billions of years ago.</p> \n<hr> \n<p><b>Update: </b>This post has been edited to reflect the probe's successful launch.</p>",Space
