title,slug,blurb,body,category
Your complete guide to never leaving your house this weekend,http://www.vox.com/2014/8/22/6057493/simpsons-bojack-horseman-review-intruders,The One I Love leads our list of ways to stay in this weekend.,"<p>Let's face it: leaving your house is really overrated. Sure, you probably have to do so to go to work, but on the weekend, when you don't have to work, there's no good reason. So ignore your errands, order a pizza, and get ready to ignore the world! You have two days with which to do absolutely nothing. Let's fill those days up with some pop culture, shall we?</p> \n<h3>Top pick: <i>The One I Love</i> \n</h3> \n<p>There are a lot of indie films about struggling marriages. There are even a lot of semi-improvised indie films about struggling marriages that feature only a handful of actors. But there's never been one quite like <i>The One I Love</i>, which takes a turn in its first act that is best not to know about going in. Suffice to say that <i>The One I Love</i> starts out in one genre, then invites elements of another over for dinner, and the two get along much better than you'd expect.</p> \n<p>At the center of the film — already available on demand but also opening in theaters this weekend — are Ethan (Mark Duplass) and Sophie (Elisabeth Moss), a couple whose relationship is in serious trouble after several years. When the film begins, they're in counseling with a therapist (played with expertly pitched lazy remove by Ted Danson), struggling to go back to the early days of their relationship. It doesn't work. So he suggests they get away for the weekend at a retreat he's sent couples to in the past. And then things shift.</p> \n<p>The best thing about <i>The One I Love</i> is that it understands that any relationship in crisis is less about the actual actions that cause the relationship to enter crisis and more about how hard it is to adjust to the fact that any two people who know each other well enough are going to eventually find their passions dulled. The chief competition for a loved one isn't some other person; it's the memory of the way things were, when you portrayed yourself as just a little bit better than you actually were to catch somebody else's eye.</p> \n<p><i>The One I Love</i> stumbles a fair bit in its third act, when it tries too hard to explain what's ""really"" going on, but for most of its running time, and particularly in its middle 30 minutes, it's an ingenious exploration of how falling out of love sometimes means clinging to old memories long after they're useful.</p> \n<h3>Binge: <i>The Simpsons</i> \n</h3> \n<p><chorus-asset class=""chorus-snippet browser_wide_media"" data-id=""666846""> <img alt=""The Simpsons"" class=""small"" src=""http://cdn2.vox-cdn.com/uploads/chorus_asset/file/666846/SIMPSONS_KRAFTWERK__hires2.0.jpg""> </chorus-asset></p> \n<p class=""caption"">""Burns Verkaufen Der Kraftwerk"" is just one of many excellent Simpsons episodes airing this weekend. (20th Century Fox)</p> \n<p>There is only one binge this weekend, and that is <a href=""http://www.vox.com/2014/8/20/6049013/the-simpsons-marathon-one-hour-per-season""><i>The Simpsons</i> marathon</a> on FXX. Most of the show's greatest episodes are airing between now and Monday, so settle down in front of your TV and head on down to Springfield.</p> \n<h3>Listen: <i style=""line-height: 1.5;"">Sea When Absent</i><span> by A Sunny Day in Glasgow</span> \n</h3> \n<div class=""align-left""><chorus-asset data-id=""666848"" class=""chorus-snippet browser_wide_media""> <img src=""http://cdn3.vox-cdn.com/uploads/chorus_asset/file/666848/sunnyday.0.jpg"" class=""small"" alt=""A Sunny Day in Glasgow""></chorus-asset></div> \n<p><span></span><span>A Sunny Day in Glasgow is an indie-music lovers background music dream. The indie-pop band's fifth full-length album </span><i style=""line-height: 1.5;"">Sea When Absent </i><span>was released on June 24, and is a huge step up from the group's earlier, less refined work. The texture created by the six-piece band gives </span><i style=""line-height: 1.5;"">Sea When Absent</i><span> the feel of a psychedelic album made for happy people who like melodies, and the band is just under-the-radar enough to make you seem cool when you bring it up in conversation.</span></p> \n<p>Start with ""The Things They Do to Me,"" a great song for doing some household chores, or doing absolutely nothing at all.</p> \n<br> \n<h3>Read: <i>The Invisible Bridge</i> by Rick Perlstein</h3> \n<div class=""align-right""> \n<chorus-asset data-id=""666858"" class=""chorus-snippet browser_wide_media""> <img src=""http://cdn0.vox-cdn.com/uploads/chorus_asset/file/666858/bridge.0.jpg"" class=""small"" alt=""The Invisible Bridge""></chorus-asset> \n<p class=""caption"">The Invisible Bridge (Simon &amp; Schuster)</p> \n</div> \n<p><span>Weekends are good for settling in with a long tome, filled with tons of information. That's what you'll find in </span><i style=""line-height: 1.5;"">The Invisible Bridge</i><span>, the third in author Rick Perlstein's series of four books chronicling the rise of the conservative right. It's possible Perlstein gets </span><i style=""line-height: 1.5;"">too</i><span> in the weeds in this book, especially since it covers only the years 1973 (the start of Richard Nixon's fall) to 1976 (when Ronald Reagan very nearly unseated a sitting president from his own party). But Perlstein writes so vividly about the world of 40 years ago that it leaps off the page, even for those who didn't live through it.</span></p> \n<p>Plus, his central thesis is fascinatingly teased out throughout. In the ‘70s, Perlstein argues, there was a brief chance when the United States almost had a reckoning, almost realized it was not perfect. And then that mostly went away, in a fashion that affected both major political parties. <i>The Invisible Bridge</i> chronicles that process, and it's unexpectedly riveting doing so. Few authors are as good at teasing out subtle psychological and philosophical shifts in the American body politic.</p> \n<h3>Sample: <i>BoJack Horseman</i> \n</h3> \n<p><chorus-asset class=""chorus-snippet browser_wide_media"" data-id=""666862""> <img alt=""Bojack Horseman"" class=""small"" src=""http://cdn1.vox-cdn.com/uploads/chorus_asset/file/666862/bojac_s1_003_h.0.jpg""> </chorus-asset></p> \n<p class=""caption"">It's BoJack Horseman! (Netflix)</p> \n<p>Netflix's latest series, <b style=""font-family: 'Alright Sans', sans-serif; font-size: 15.555556297302246px; line-height: 1.5;""><i>BoJack Horseman</i></b><span>, has a similar feel to lots of other adult-themed, edgy animated shows, so if you like that sort of thing, it might be for you. Will Arnett voices the title character, a horse who was somehow the father on a family sitcom in the ‘90s (think Bob Saget, but as a horse). Now, his career's on the rocks, and he lives with a guy named Todd (voice of Aaron Paul) while working on his autobiography with a young writer (voice of Alison Brie). There are occasional amusing moments in </span><i style=""font-family: 'Alright Sans', sans-serif; font-size: 15.555556297302246px; line-height: 1.5;"">BoJack</i><span>, but the show-business satire is warmed over, and the animation is frequently stiff and uninvolving. There's no real idea here beyond ""Wouldn't it be funny if a horse did things?"" And it is. Just very rarely.</span></p> \n<p><b>How long should I give it?: </b>If you're intrigued after the first episode, maybe keep going. If not, you can bail.</p> \n<h3><span>Sample: <i>The Intruders</i></span></h3> \n<p><chorus-asset class=""chorus-snippet browser_wide_media"" data-id=""666864""> <img alt=""The Intruders"" class=""small"" src=""http://cdn0.vox-cdn.com/uploads/chorus_asset/file/666864/INT101C_0015.0.jpg""> </chorus-asset></p> \n<p class=""caption"">The Intruders is eerie, but not much else. (BBC America)</p> \n<p>BBC America is following up the premiere of <a href=""http://www.vox.com/2014/8/22/6055755/doctor-who-explained-who-is-doctor-who"" target=""_blank"">the newest season of <i>Doctor Who</i></a> with its latest original series, <b><i>The Intruders</i></b>. And while this show is going to have devoted acolytes, it's no <i>Orphan Black</i>. That show was engaging from the word go, while <i>The Intruders</i> is mystifying from the word go. In the first handful of episodes, it's difficult to say what's happening without reading the press notes BBC America provided, or looking for a plot summary of the book on which the series is based. That might be all right if the characters were involving, but short of a little girl who may not be what she seems, the show struggles in this regard. Still, there are some legitimately unsettling moments throughout, and at only eight episodes, there's always the possibility of a strong payoff. There's an audience for unsettling weirdness, and maybe you're part of it.</p> \n<p><!--[if gte mso 9]><xml> 0   0   1   919   5240   Vox Media   43   12   6147   14.0 </xml><![endif]--> <!--[if gte mso 9]><xml> Normal   0               false   false   false      EN-US   JA   X-NONE </xml><![endif]--><!--[if gte mso 9]><xml> </xml><![endif]--> <!--[if gte mso 10]> \n<style> \n /* Style Definitions */ \ntable.MsoNormalTable \n\t{mso-style-name:""Table Normal""; \n\tmso-tstyle-rowband-size:0; \n\tmso-tstyle-colband-size:0; \n\tmso-style-noshow:yes; \n\tmso-style-priority:99; \n\tmso-style-parent:""""; \n\tmso-padding-alt:0in 5.4pt 0in 5.4pt; \n\tmso-para-margin:0in; \n\tmso-para-margin-bottom:.0001pt; \n\tmso-pagination:widow-orphan; \n\tfont-size:12.0pt; \n\tfont-family:Cambria; \n\tmso-ascii-font-family:Cambria; \n\tmso-ascii-theme-font:minor-latin; \n\tmso-hansi-font-family:Cambria; \n\tmso-hansi-theme-font:minor-latin;} \n</style> \n<![endif]--></p> \n<p><b>How long should I give it?: </b>If you're not at least vaguely interested by the first five minutes, you can check out. Everything that follows is more of the same.</p>",Movies
British man gets almost 3 years in prison for uploading Fast and Furious 6,http://www.vox.com/2014/8/25/6065197/british-man-gets-almost-3-years-in-prison-for-uploading-fast-and,A British man was sentenced to 33 months for uploading a copy of Fast and Furious 6. The judge faulted the man for his arrogant attitude.,"<p>If you download a pirated movie on the internet, your odds of facing serious penalties are fairly modest. But Hollywood studios are becoming increasingly aggressive about prosecuting those who distribute movies in violation of copyright law. An extreme case of this came last week, when a judge in the United Kingdom <a href=""http://arstechnica.com/tech-policy/2014/08/british-man-sentenced-to-nearly-three-years-in-prison-for-movie-piracy/"">sentenced 25-year-old Philip Danks</a> to 33 months in prison for illegally distributing the movie <i>Fast and Furious 6</i>.</p> \n<p>A couple of factors contributed to the man's harsh sentence. First, Danks wasn't just another guy sharing the movie online; he was the guy who uploaded the original pirated copy to peer-to-peer networks. He recorded the film while sitting in a local movie theater last year. The film was downloaded 700,000 times, which the film's distributor, Universal Pictures, argues cost it $2.5 million.</p> \n<p>Second, <a href=""http://www.bbc.com/news/technology-28896675"">Danks was defiant</a>, even after he was arrested. A few days after his arrest, he posted to Facebook: ""Seven billion people and I was the first. F*** you Universal Pictures."" He reportedly continued distributing the film even after his arrest. The judge who handed down the sentence chastised Danks for his ""bold, arrogant, and cocksure"" attitude.</p>",Movies
"New horror film As Above, So Below: see it or skip it?",http://www.vox.com/2014/8/29/6083785/as-above-so-below-review,"The movie has some effective, unsettling images, but it's also got an essentially meaningless story.","<p>It's a quiet Labor Day weekend at the multiplex, with releases led by the new horror film <i>As Above, So Below</i>, which involves a bunch of young people who head into the catacombs of Paris and find evil lurking (not monsters, just evil in general).</p> \n<p>We've seen it. Should you go?</p> \n<h3>Why you should go:</h3> \n<p>For all of its flaws — and there are many of them — <i>As Above, So Below</i> creates an incredibly pernicious and overwhelming sense of dread. Much of this is thanks to the sound design, which slowly becomes more and more omnipresent, until it's all but blasting the audience by the film's climax. It's a surprisingly effective bit of film craft, and it ramps up the tension at a point when many films run out of steam.</p> \n<p>But just as much is thanks to how vividly cinematographer Léo Hinstin captures the sheer terror of being in a confined space with nowhere to run. <i>As Above</i> makes viewers feel just as claustrophobic as the characters, and much of that is thanks to Hinstin's oppressive use of darkness and tight spaces.</p> \n<p>It also has a surprisingly involving story, at least in the early going. While it eventually becomes a standard-issue horror film, the movie starts out as a <i>Da Vinci Code</i>-style quest for the alchemical legend known as the philosopher's stone. At the center of that quest is a woman named Scarlet (Perdita Weeks), who makes an able, entertaining heroine. She's the sort of character you'll instinctively want to see succeed, which makes the early going — when the film is a more straightforward treasure hunt — fairly entertaining, as these things go.</p> \n<p>Director John Erick Dowdle also has a solid grasp of what makes a creepy image, and there are moments when he allows the film to tip over into complete nightmare logic, like when Scarlet and her crew (including old friend George, played by Ben Feldman of TV's <i>Mad Men</i>) enter the catacombs and come upon some unholy ritual performed by a group of women in heavy makeup and white gowns, singing composer Max Richter's singularly unnerving score. It sets the tone for what's to come, and it sets the skin to crawling.</p> \n<p>Plus, the premise of a horror movie set in the Paris catacombs is so perfect it's a wonder it hasn't already been done 500 times.</p> \n<h3>Why you shouldn't go:</h3> \n<p>Unfortunately, atmosphere doesn't prove enough to save <i>As Above</i>. Sometimes, a horror movie can get by solely on mood, but that requires careful composition and attention to the build of the film.</p> \n<p>Thus, the central problem here might have been to film the movie as a found-footage horror film, purporting to be the footage from a documentary a filmmaker is making about Scarlet's quest to find the stone and rehabilitate her father's reputation. (He was the one who first was obsessed with the stone.) Too much of the film is spent with the characters running from one place to another, their head-mounted cameras joggling along with them, never allowing the audience to get a good sense of the creeping menace at the catacombs' heart. The film's story is one of slow-building dread, but found-footage filmmaking usually works best as a constant series of jolts to the heart. The filmmaking approach and the story are often in direct opposition.</p> \n<p>And, yes, a striking sense of mood is sometimes enough, but <i>As Above</i>'s story eventually disintegrates into complete meaninglessness. The third act hinges on a series of reveals that either pass so breathlessly that they don't get any room for the audience to feel their full effect or don't get the explanation required to make sense of them. <i>As Above</i> wants desperately to have a strongly emotional story at its core, but it doesn't possess the character development necessary to pull it off. Instead, the characters boil down to a long series of mysteries that then get perfunctory answers as the film wraps up.</p> \n<p>And if you've ever wondered in a found-footage horror film why the characters didn't just stop filming, or who took the time to edit all of this footage together, you're largely missing the point of the form, but you are going to wonder that <i>so much more</i> with this film.</p> \n<h3>Final verdict</h3> \n<p><!--[if gte mso 9]><xml> 0   0   1   640   3651   Vox Media   30   8   4283   14.0 </xml><![endif]--> <!--[if gte mso 9]><xml> Normal   0               false   false   false      EN-US   JA   X-NONE </xml><![endif]--><!--[if gte mso 9]><xml> </xml><![endif]--> <!--[if gte mso 10]> \n<style> \n /* Style Definitions */ \ntable.MsoNormalTable \n\t{mso-style-name:""Table Normal""; \n\tmso-tstyle-rowband-size:0; \n\tmso-tstyle-colband-size:0; \n\tmso-style-noshow:yes; \n\tmso-style-priority:99; \n\tmso-style-parent:""""; \n\tmso-padding-alt:0in 5.4pt 0in 5.4pt; \n\tmso-para-margin:0in; \n\tmso-para-margin-bottom:.0001pt; \n\tmso-pagination:widow-orphan; \n\tfont-size:12.0pt; \n\tfont-family:Cambria; \n\tmso-ascii-font-family:Cambria; \n\tmso-ascii-theme-font:minor-latin; \n\tmso-hansi-font-family:Cambria; \n\tmso-hansi-theme-font:minor-latin;} \n</style> \n<![endif]--></p> \n<p>If you're a really big fan of horror, this might be worth a matinee or a rental someday. But despite some cool ideas that suggest Dowdle and company will make a great scary movie someday, this is eminently skippable.</p>",Movies
