title,slug,blurb,body,category
Snoop Dogg and Sir Richard Branson are teaming up to fight for your right to get high,http://www.vox.com/2014/10/2/6882303/snoop-dogg-and-richard-branson-will-appear-in-a-movie-about-the-war,"A rapper and a billionaire, among others, take on America's drug policies.","<p>Joe Rogan, Snoop Dogg, and Virgin Group founder Richard Branson will appear in the <a href=""https://www.kickstarter.com/projects/scorgie/the-culture-high"">crowd-funded</a> documentary called the <i><a href=""http://www.theculturehigh.com/"">The Culture High</a>, </i>opening October 17 in limited theaters. In it, they explain their opposition to <a href=""http://www.vox.com/cards/war-on-drugs-marijuana-cocaine-heroin-meth/war-on-drugs-goals"">the war on drugs</a> and their support for <a href=""http://www.vox.com/cards/marijuana-legalization"">marijuana legalization</a>. Branson shared this trailer for the movie in <a href=""http://www.virgin.com/richard-branson/the-war-on-drugs-what-exactly-is-going-on-here"">a post</a> on Virgin's website on Wednesday:</p> \n<center> \n<p><iframe src=""//player.vimeo.com/video/107305488"" frameborder=""0"" height=""281"" width=""500""></iframe></p> \n</center> \n<p>One of the big questions raised by the trailer is why politicians are taking so long to embrace legalization and <a href=""http://www.vox.com/cards/marijuana-legalization/what-is-medical-marijuana"">medical marijuana</a> when both issues have so much support. (About <a href=""http://www.vox.com/cards/marijuana-legalization/-popular-opinion-changing-marijuana-legalization"">58 percent</a> of Americans back full legalization, <a href=""http://www.gallup.com/poll/165539/first-time-americans-favor-legalizing-marijuana.aspx"">according to Gallup</a>.)</p> \n<p>When I <a href=""http://www.vox.com/2014/10/1/6858173/marijuana-legalization-majority-movement"">posed the question</a> to experts on social movements, they said marijuana just doesn't have the priority among the electorate or kind of fundraising potential that politicians need to take on an issue.</p> \n<p>Politicians generally need a concerted movement ""that will give  [them] time and money and networks [they] can't get otherwise,"" said Daniel Schlozman, a  political scientist at Johns Hopkins University, in <a href=""http://www.vox.com/2014/10/1/6858173/marijuana-legalization-majority-movement"">a previous interview</a>. ""Without that kind of preference intensity, if you're  [Senator] Bernie Sanders, you're going to want to talk about social  democracy, and if you're [Senator] Elizabeth Warren, you're going to  want to talk about the banks. There's no particular reason for you to  dilute your core efforts to move the party.""</p> \n<p>But as the political pressure builds, some politicians are beginning to move toward public opinion on the issue. Likely 2016 presidential candidate Hillary Clinton previously said she <a href=""http://www.vox.com/2014/6/25/5841232/the-clintons-seem-a-lot-more-relaxed-on-marijuana"">supports</a> medical marijuana ""for people who are in extreme medical conditions""  and is <a href=""http://www.vox.com/2014/6/25/5841232/the-clintons-seem-a-lot-more-relaxed-on-marijuana"">open</a> to letting the states act as ""the laboratories of  democracy"" for full legalization efforts.</p> \n<p>If Clinton's comments are any indication, prominent Democrats are at least preparing for marijuana to turn into a national political issue in the future.</p> \n<p><i>To learn more, check out Vox's <a href=""http://www.vox.com/cards/war-on-drugs-marijuana-cocaine-heroin-meth/war-on-drugs-goals""><i>war on drugs explainer</i></a>, <a href=""http://www.vox.com/cards/marijuana-legalization""><i>marijuana legalization explainer</i></a>, and <a href=""http://www.vox.com/2014/10/1/6872975/marijuana-legalization-maps-charts-facts"">24 maps and charts that explain marijuana</a>.<br></i></p>",Movies
The insane conspiracy theories of Naomi Wolf,http://www.vox.com/2014/10/5/6909837/naomi-wolf-isis-ebola-scotland-conspiracy-theories,The celebrated author suggests that the US government faked the ISIS beheading videos and is plotting to bring Ebola to America.,"<p>Author and former Democratic political consultant Naomi Wolf published a series of Facebook posts on Saturday in which she questioned the veracity of the ISIS videos showing the murders and beheadings of two Americans and two Britons, strongly implying that the videos had been staged by the US government and that the victims and their parents were actors.</p> \n<p>Wolf published a separate Facebook post, also on Saturday, suggesting that the US was sending troops to West Africa not to assist with Ebola treatment but to bring Ebola back to the US to justify a military takeover of American society. She also suggested that the Scottish independence referendum, in which Scots voted to remain in the United Kingdom, had been faked.</p> \n<p>Wild-eyed conspiracy theories are common on Facebook. You may naturally wonder, then, why you are reading about these ones. Partly it's because Wolf's posts on ISIS deeply offended many people who knew one or more of the four murdered Westerners whom Wolf accused of being actors. And as American victims James Foley and Steven Sotloff were journalists, their outraged friends included a number of fellow journalists, so you may have seen them discussing Wolf's posts online and wondered what had happened.</p> \n<p><q aria-hidden=""true"" class=""right"">""it takes five people to stage an event like this — two to be 'parents'""</q></p> \n<p>Perhaps more importantly, though, despite Wolf's turn into conspiracy theory, she is still more widely known for her earlier and much-respected work on feminism, as well as her political consulting for the 1996 Bill Clinton and 2000 Al Gore presidential campaigns on reaching female voters. I was taught parts of Wolf's 1990 book ""The Beauty Myth"" in school and admit that, until researching her more recent views more fully for this post, still mostly associated her with this and other well-respected work. In other words, I was carrying the assumption that Wolf is a respected and authoritative figure to be taken seriously. I can only assume that I was not alone in this.</p> \n<p>Her initial posts on ISIS repeatedly stated that confirmation of the authenticity of their beheading videos ""<a href=""https://www.facebook.com/naomi.wolf.author/posts/10152721913269476"">has not happened yet</a>."" Wolf said that the media was ignoring ""journalistic red flags"" in that the sole source of the videos had been ""SITE, which is run by an anti-Muslim activist with half a million dollars in US funding in 2004."" (In fact, the videos were widely distributed on open-source jihadist online outlets. Maryland-based nonprofit SITE monitors extremist social media.) She also detailed an alleged incident, which I was not able to confirm, of a website ""based in Doha, address registered at a private intelligence firm in the UK"" that she said had spread news of a Canadian journalist, who turned out not to exist, taken hostage in Syria.</p> \n<p>This culminated in a now-deleted<span> post, reproduced below, suggesting that the ISIS beheading videos had been staged, as had the initial abductions of the two American journalists and two British aid workers killed on camera. She hints that she believes this was done by the US military.</span></p> \n<blockquote lang=""en"" data-conversation=""none"" class=""twitter-tweet""> \n<p><a href=""https://twitter.com/penkill"">@penkill</a> Here it is, for your reference. <a href=""http://t.co/H5RxHZEXAp"">pic.twitter.com/H5RxHZEXAp</a></p> \n— Graeme Wood (@gcaw) <a href=""https://twitter.com/gcaw/status/518549774514286594"">October 4, 2014</a>\n</blockquote> \n<p> \n<script charset=""utf-8"" src=""//platform.twitter.com/widgets.js""></script> \n</p> \n<p>Like many other journalists who cover the Middle East, I had previously met both murdered American journalist James Foley and his parents (in my case, in 2011) and can attest, although I deeply regret that it is necessary to do so, that they are not actors.</p> \n<p>Wolf deleted the post at the urging of New York Times foreign correspondent Rukmini Callimachi, who commented beneath it on Facebook. Callimachi, who has reported extensively on these cases, later explained on Twitter (I've cleaned up the abbreviations that are common Twitter shorthand), ""What she fails to understand is that the kidnappings — 23 in total — have been under blackout for much of the past two years because ISIS told families of Henning, Foley, Kassig, etc., their sons would be killed if it became public.""</p> \n<p>After deleting her post at Callimachi's request, Wolf posted again, reiterating her earlier accusations and promising to ""repost"" with ""new reporting."" She also posed a series of questions to the New York Times implying that the newspaper was complicit in fabricating the story. She focused her criticism on the idea that all information on the ISIS kidnappings and videos had been sourced only to SITE, which she again noted had once received a US government grant. She implied that the media had been unable or unwilling to find a second source because the entire story had been staged. (In fact, the kidnappings and murders have been reported based on dozens of sources, including Syrians in the ISIS headquarters of Raqqa and a number of fellow hostages who have been released.)</p> \n<p>Later, Wolf <a href=""https://www.facebook.com/naomi.wolf.author/posts/10152723101654476"">scolded</a> the New York Times for not answering her questions and accused it of failing to meet ""basic j-school two source journalism."" <span>In </span><a href=""https://www.facebook.com/naomi.wolf.author/posts/10152723584039476"" style=""line-height: 1.5; background-color: #ffffff;"">another post</a><span>, Wolf stated, ""I stand by what I wrote today"" about ISIS. She then described a ""Pakistani lawyer who is a fourth-generation scion of a major Pakistani political family"" who had told her that ISIS was funded by the United States and Israel, along with Saudi Arabia. She described the lawyer as a ""credible source"" and uncritically presented his claims as ""the news behind the news.""</span></p> \n<p>In the course of Saturday, Wolf also <a href=""https://www.facebook.com/naomi.wolf.author/posts/10152723629514476"">commented</a> on Australia, where she said ""ISIS hype"" was being used to justify ""loss of freedoms,"" and on supposed fraud in the Scottish independence referendum, including a <a href=""https://www.facebook.com/naomi.wolf.author/posts/10152719501739476"">letter</a> she sent to the Scottish Electoral Commission accusing it of a cover-up.</p> \n<p>She also posted at great length on Ebola, including a <a href=""https://twitter.com/BenMcCombe/status/518493472701952000"">post</a> arguing that the US troops traveling to Liberia were not actually sent to help fight Ebola, but rather to further the aim of a ""militarized Africa"" and because this ""creates a direct vector into the US"" for Ebola, meant ""to justify military condoning [sic] of US population.""</p> \n<div id=""fb-root""></div> \n<p> \n<script type=""text/javascript""><!-- \n(function(d, s, id) { var js, fjs = d.getElementsByTagName(s)[0]; if (d.getElementById(id)) return; js = d.createElement(s); js.id = id; js.src = ""//connect.facebook.net/en_US/all.js#xfbml=1""; fjs.parentNode.insertBefore(js, fjs); }(document, 'script', 'facebook-jssdk')); \n// --></script> \n</p> \n<div class=""fb-post"" data-href=""https://www.facebook.com/naomi.wolf.author/posts/10152722211314476"" data-width=""700""> \n<div class=""fb-xfbml-parse-ignore"">\n<a href=""https://www.facebook.com/naomi.wolf.author/posts/10152722211314476"">Post</a> by <a href=""https://www.facebook.com/naomi.wolf.author"">Naomi Wolf</a>.</div> \n</div> \n<p> </p> \n<p><span>Wolf's record of respectability gives her a platform and helps advance her conspiracy theories further than they would travel otherwise. </span><span>This is not to argue that all of Wolf's earlier work must be discarded on the basis of these Facebook posts, but rather to urge others to see the broader context of Wolf and her thinking.</span><span> In other words, it is important for readers who may encounter Wolf's ideas to understand the distinction between her earlier work, which rose on its merits, and her newer conspiracy theories, which are unhinged, damaging, and dangerous.</span></p>",Movies
See the trailer for one of Robin Williams's last films,http://www.vox.com/xpress/2014/10/12/6965785/robin-williams-trailer-last-films-a-merry-friggin-christmas,A Merry Friggin' Christmas hits theaters November 7.,"<p>When Robin Williams passed away in August, he still had <a target=""_blank"" href=""http://www.vox.com/2014/8/12/5993293/the-four-movies-robin-williams-finished-before-he-died"">four new films</a> he had starred in, just waiting for audiences to see. One of those films, <i>Boulevard</i>, has already made its debut at the 2014 Tribeca Film Festival. His remaining three films will be released over the next few months, including <i>A Merry Friggin' Christmas</i>, whose trailer you can watch above.</p> \n<p>The film stars Williams alongside Joel McHale, Wendi McLendon-Covey, Lauren Graham, and Oliver Platt. McHale plays the son Williams's character doesn't have a good relationship with, something that's put to the test when the two have to take a holiday road trip together. All in all, it should make for some Christmas-themed comedy. It will be released in theaters November 7.</p> \n<p>Williams also has a role in the latest <i>Night at the Museum</i> film, out Dec. 16, and the animated film <i>Absolutely Anything</i>, out next year.</p>",Movies
How copyright law gives Amazon too much power over the book industry,http://www.vox.com/2014/10/25/7061603/the-way-to-reduce-amazons-power-in-the-book-market-is-to-reform,The 1998 Digital Millennium Copyright Act make sit hard to compete with Amazon in the e-book business.,"<p>I mostly agree with <a href=""http://www.vox.com/2014/10/22/7016827/amazon-hachette-monopoly"" target=""_blank"">my colleague Matt Yglesias's argument</a> that Amazon is doing the world a favor by crushing book publishers. But there's at least<span> one way US law gives Amazon excessive power, to the detriment of publishers, authors, and the reading public: ill-conceived copyright regulations lock consumers into Kindle's book platform, making it hard for new e-book platforms to gain traction.</span></p> \n<p>To see why this is a big deal, it's useful to remember how things worked before Congress changed the law in 1998. In the late 1990s, before the iPod, a variety of startups were experimenting with portable digital music players. None of these companies were big enough to get licensing deals with major music labels. But that didn't matter, because customers didn't need anyone's permission to rip the music CDs they already owned onto their hard drives, and from there to their MP3 players.</p> \n<p>This situation was good for innovation — it was easy to move from one MP3 player to another, and take your music with you — but music publishers hated it. They didn't get an opportunity to sell the same music to customers over and over again. They also argued that the ease of copying promoted piracy.</p> \n<p><span>So in 1998 they got Congress to pass the Digital Millennium Copyright Act, which made it a federal crime to unscramble encrypted content without the permission of copyright holders.</span></p> \n<p><span>The law didn't affect music CDs because it was too difficult to add copy protection to the well-established CD format. But all of the major media formats developed since the DMCA passed have taken advantage of the law. </span><span>That's why iTunes won't let you rip your DVD collection the way it will rip CDs. Because DVDs are copy-protected, adding a ""rip DVD"" feature to iTunes would be a felony.</span></p> \n<p><span>And while the law was passed at the behest of content creators, it also gave a lot of power to platform owners. If you buy a movie on iTunes, you're effectively forced to continue buying Apple devices if you want to keep watching the movie. Tools to transfer copy-protected movies you've purchased from iTunes onto another platform exist, but they're illegal and, accordingly, not very user-friendly.</span></p> \n<p>Amazon has taken advantage of the DMCA too. Kindle books come copy-protected so that only Amazon-approved software can read it without breaking the law. Of course, software to convert it to other formats <a href=""http://www.howtogeek.com/162994/how-to-strip-the-drm-from-your-kindle-ebooks-for-cross-device-enjoyment-and-archiving/"" target=""_blank"">exists</a>, but it's illegal and accordingly isn't very convenient or user-friendly.</p> \n<p><q aria-hidden=""true"" class=""right""><span>Kindle books come copy-protected so that only Amazon-approved software can read it without breaking the law</span></q></p> \n<p>And that creates a huge barrier to entry. People who want to create new e-reader apps or devices can't do what MP3 startups did in the 1990s and offer to automatically import your existing e-books from Kindle, iTunes, or other major platforms. Instead, they have to start from scratch, creating their own e-book store and convincing all the major publishers to sign up for it.</p> \n<p>Even more daunting, they have to convince customers to toss their existing e-book libraries and buy new copies of their e-books on the new platform — or split their time between multiple platforms.</p> \n<p>Hence, the DMCA is increasing the already significant market power conferred by Amazon's control of the most popular e-book platform. So if you're worried that the company has too much control over the publishing industry, a good place to start would be to change the DMCA and give consumers the freedom to move content they purchased from one device to another.</p>",Movies
Loved Book of Life? Then you need to see this short film by its director,http://www.vox.com/2014/10/27/7070215/watch-this-short-film-from-the-director-of-book-of-life-jorge-gutierrez,Jorge R. Gutierrez won a student Emmy in 2001 for Carmelo.,"<p>If you haven't seen <i>Book of Life</i> yet, you should do that. It's had a pretty solid <a target=""_blank"" href=""http://www.boxofficemojo.com/movies/?id=bookoflife14.htm"">box office</a> so far, and has gotten <a target=""_blank"" href=""http://www.theguardian.com/film/2014/oct/26/book-life-vibrantly-alternative-animation"">strong reviews</a> from <a target=""_blank"" href=""http://variety.com/2014/film/reviews/film-review-the-book-of-life-1201326270/"">critics</a>. The story follows Manolo, voiced by Diego Luna, as he makes his way through fantasy worlds in order to reconnect with the woman he loves. Taking its cue from the holiday <span>El </span><span>Día de Muertos (Day of the Dead), the film is a pastiche of different cultural traditions, combining Mexican folklore with American pop music. Though some critics have knocked the film's plot for being a tad <a href=""http://www.washingtonpost.com/goingoutguide/movies/the-book-of-life-movie-review-a-whimsical-romp-through-the-afterlife/2014/10/16/130e91cc-52ed-11e4-892e-602188e70e9c_story.html"" target=""_blank"">too complicated</a>, <i>Book of Life</i> has been universally and consistently recognized for its beautiful, fanciful style of animation. </span></p> \n<p>Much of that is thanks to the film's producer, the incomparable Guillermo del Toro, who is no stranger to fantasy stories. Less well known is the name Jorge R. Gutierrez, the writer and director of <i>Book of Life</i>. The film has helped launch Gutierrez to a new level of fame. But if you take a look at a short he made almost 15 years ago, you'll see that he's long had a talent for experimental animation.</p> \n<p>Gutierrez got his big break while he was pursuing a master's of fine arts at California Institute of the Arts. For his 2000 thesis film, he created an eight-minute animated short titled <i>Carmelo </i>about a young boy with dreams of becoming a bullfighter. (Bullfighting, by the way, is an important plot point in <i>Book of Life</i>.) The short went on to play at Cannes film fest in 2001, and earned Gutierrez a student Emmy that same year. Since then, Gutierrez has gone on to positions at Nickelodeon and DreamWorks (which originally picked up <i>Book of Life</i>, before <span>Gutierrez took</span><span> the film to Dallas-based Reel FX Creative Studios).</span></p> \n<p>Watch <i>Carmelo</i> above.</p>",Movies
Benedict Cumberbatch is Marvel's Doctor Strange,http://www.vox.com/xpress/2014/10/27/7079259/benedict-cumberbatch-marvel-dr-strange,Things are going to get weird.,"<p><a style=""font-size: 15.1999998092651px; line-height: 1.65;"" href=""http://marvel.com/news/movies/23754/benedict_cumberbatch_to_play_doctor_strange"" target=""_blank"">Marvel announced</a> on Thursday that <a href=""http://www.vox.com/2014/12/3/7326077/benedict-cumberbatch"" target=""_blank"">Benedict Cumberbatch</a> has officially signed to play Dr. Strange.</p> \n<p>Dr. Strange will be part of Marvel's seismically successful Avenger franchise (the <a href=""http://www.vox.com/2014/10/23/7047745/avengers-age-of-ultron-trailer-explained"">trailer for <i>Avengers: Age of Ultron</i></a> broke Marvel records, and <a href=""http://insidemovies.ew.com/2014/10/24/avengers-age-of-ultron-trailer-record/"">garnered over 34 million views</a> in its first week). Strange has his own movie slated for 2016 and is expected to be in the third <i>Avengers</i> movie which is scheduled for 2018. Before Cumberbatch was announced, Joaquin Phoenix, Tom Hardy, and <a href=""http://www.vox.com/2014/10/20/6995279/avengers-age-of-ultron-rumors-spoilers"">Ryan Gosling</a> were all rumored to be gunning for the part.</p> \n<p>Dr. Strange might be the biggest mainstream role yet for Cumberbatch, who is known for playing the lead on BBC's <i>Sherlock, </i>as well as the villain Khan in <i>Star Trek Into Darkness. </i>He's considered an Oscar contender this year for his role as British mathematician and inventor of the computer, Alan Turing, in <i>The Imitation Game. </i></p> \n<div class=""image-compare-tool ICT-vox""> \n<div class=""image-compare-images""> \n<div class=""image-compare-bottom""><img src=""http://cdn1.vox-cdn.com/uploads/chorus_asset/file/2397178/1242100-doctor_strange_2.0.jpg""></div> \n<div class=""image-compare-top""><img src=""http://cdn1.vox-cdn.com/uploads/chorus_asset/file/2397172/457508502.0.jpg""></div> \n</div> \n</div> \n<p>Doctor Strange is scheduled for release on November 4, 2016. \n<link type=""text/css"" rel=""stylesheet"" media=""all"" href=""http://apps.voxmedia.com/tools/stylesheets/tools/image-slider-public-b9271013.css""> \n<script src=""http://apps.voxmedia.com/tools/javascripts/tools/image-slider-public-a2152966.js""></script> \n</p>",Movies
